storyID,story,sentenceID,sentence,kepedulian,menyakiti,keadilan,kecurangan,loyalitas,pengkhianatan,otoritas,pembangkangan,kesucian,kemerosotan,kebebasan,penindasan,kepedulian_prob,menyakiti_prob,keadilan_prob,kecurangan_prob,loyalitas_prob,pengkhianatan_prob,otoritas_prob,pembangkangan_prob,kesucian_prob,kemerosotan_prob,kebebasan_prob,penindasan_prob,positive_label_count,max_confidence
112,Si Nome,77,"Begitulah Si Nome berjalan tanpa mengetahui ke mana tujuannya, pekerjaan apa yang harus dikerjakannya.",0,0,0,0,0,0,1,0,0,0,0,0,5.1795745093841106e-05,4.538375651463866e-05,6.11770519753918e-05,4.057538171764463e-05,6.133271381258965e-05,9.795041114557534e-05,0.8883321285247803,0.0015564761124551296,9.328111627837643e-05,8.909503958420828e-05,0.0014987026806920767,0.0001559975353302434,1,0.8883321285247803
113,Mentiko Betuah,2,Raja itu sangat disenangi oleh rakyatnya.,0,0,1,0,0,0,0,0,0,0,0,0,5.10258469148539e-05,4.368802183307707e-05,0.9993818998336792,3.949128949898295e-05,6.250732258195058e-05,9.786283771973103e-05,0.00018972954421769828,0.001561427372507751,0.00010372653923695907,8.915196667658165e-05,0.0006950404495000839,0.00015030232316348702,1,0.9993818998336792
113,Mentiko Betuah,27,Mereka menyembelih tujuh ekor kerbau dan upacara selamatan itu berlangsung tujuh hari tujuh malam lamanya.,0,0,0,0,0,0,0,0,1,0,0,0,5.106518437969498e-05,5.290094850352034e-05,6.281428068177775e-05,4.1232800867874175e-05,6.880301953060552e-05,9.840098209679127e-05,0.000283705594483763,0.001558603486046195,0.9367727637290955,0.0001308747159782797,0.0019300421699881554,0.00032645324245095253,1,0.9367727637290955
113,Mentiko Betuah,49,la berjumpa dengan anak-anak kampung yang sedang menembak burung dengan ketapelnya.,0,1,0,0,0,0,0,0,0,0,0,0,5.505949229700491e-05,0.9947689771652222,6.409116758732125e-05,4.9744794523576275e-05,7.495736645068973e-05,9.868091001408175e-05,0.00021165677753742784,0.0015601343475282192,0.00010379777813795954,9.566800872562453e-05,0.002008395968005061,0.00032590870978310704,1,0.9947689771652222
113,Mentiko Betuah,54,Di sana ia melihat segerombolan orang sedang menembak seekor ular yang besar.,0,1,0,0,0,0,0,0,0,0,0,0,5.331553256837651e-05,0.9981527924537659,6.380467675626278e-05,4.256587999407202e-05,6.37801640550606e-05,9.86477971309796e-05,0.00016995487385429442,0.0015607503009960055,0.00010076338367071003,9.14381816983223e-05,0.0028060164768248796,0.00017890357412397861,1,0.9981527924537659
113,Mentiko Betuah,59,"Demikianlah selama dalam perjalanan itu, di mana saja ia menemui orang yang sedang menganiaya binatang liar kepadanya diberikan uang agar mereka menghentikan perbuatannya itu.",0,1,0,0,0,0,0,0,0,0,0,0,7.2937757067848e-05,0.9997766613960266,6.163508805911988e-05,4.4511813030112535e-05,6.454947288148105e-05,0.0001142390028689988,0.0008933162898756564,0.0015637007309123874,0.00011805781105067581,0.00011806320253526792,0.003658768255263567,0.00018698284111451358,1,0.9997766613960266
113,Mentiko Betuah,72,"Ketika itu ular berpesan padanya, "" Apa yang kau ingini dengan Mentiko Betuah ini, tetapi dengan syarat yaitu setiap malam Jumat ia harus diasapi dengan kemeyan "".",0,0,0,0,0,0,1,0,0,0,0,0,5.3404430218506604e-05,5.140847497386858e-05,6.398979166988283e-05,4.166561848251149e-05,6.388065230567008e-05,0.00011576955148484558,0.9857556223869324,0.0015798595268279314,0.00030252861324697733,8.869136945577338e-05,0.0029150526970624924,0.00015244573296513408,1,0.9857556223869324
113,Mentiko Betuah,86,"Adaa yang menganiaya burung, ular, monyet dan lain-lain.",0,1,0,0,0,0,0,0,0,0,0,0,7.072312291711569e-05,0.99980229139328,6.671054143225774e-05,4.1133440390694886e-05,6.821276474511251e-05,9.852764924289659e-05,0.00015988496306817979,0.001562075805850327,0.00011138437548652291,9.301491809310392e-05,0.004312668927013874,0.00023161883291322738,1,0.99980229139328
115,Mencari Tiga Buah Kelimat,94,"Dengan terbunuhnya Empeng Besoe lalu penduduk kampung itu pun merasa tenteram dan aman, dan persatuan dalam kampung itu pun dapat terjelma.",0,1,0,0,0,0,0,0,0,0,0,0,5.476509977597743e-05,0.992422878742218,7.7217940997798e-05,4.0793347579892725e-05,6.866642070235685e-05,0.00011077183444285765,0.00030466759926639497,0.0015673290472477674,0.00014249217929318547,9.117983427131549e-05,0.002645482076331973,0.00015705781697761267,1,0.992422878742218
116,Putroe Sunoe,34,"Mendengar ucapan itu timbullah amarah telangkai kedua, "" Mengapa tuan menyindir sekejam itu, saya datang ke mari cukup dengan syarat-syaratnya, saya telah menyerahkan lima mayam emas sebagai pertanda ikatan peryunangan.""",0,0,0,0,0,0,1,0,0,0,0,0,5.913039785809815e-05,0.00046287220902740955,6.411965296138078e-05,4.656787132262252e-05,6.249742727959529e-05,0.00018446047033648938,0.9560319781303406,0.0016085919924080372,0.000500781461596489,0.00012544644414447248,0.0038787464145570993,0.0018438172992318869,1,0.9560319781303406
116,Putroe Sunoe,56,Setelah itu terhadap dayang-dayangnya diperintahkan agar menyajikan minuman karena sejak tadi mereka asyik bertengkar saja.,0,0,0,0,0,0,1,0,0,0,0,0,5.436785795609467e-05,0.002205547410994768,6.295982166193426e-05,4.02792175009381e-05,6.25993125140667e-05,0.00010042668145615608,0.9873384237289429,0.0015604776563122869,0.00010003786883316934,0.00013920800120104104,0.0020834405440837145,0.00027504327590577304,1,0.9873384237289429
116,Putroe Sunoe,60,"Langkahnya terasa berat dan badannya terasa menggigil oleh situasi, dan oleh tamunya yang persoalannya harus segera diselesaikan tuntas.",0,0,0,0,0,0,1,0,0,0,0,0,5.133200465934351e-05,4.631459160009399e-05,6.047750503057614e-05,4.058792183059268e-05,6.705411215079948e-05,0.00010301702423021197,0.971448540687561,0.0015623392537236214,0.00013418450544122607,0.00011981614807154983,0.0015685249818488955,0.00022411829559132457,1,0.971448540687561
117,Kisah Putri Ular,50,"Dia lebih senang tinggal di alam bebas, di mana ia bisa merenungkan kesalahannya dan belajar untuk menjadi lebih bijaksana.",0,0,1,0,0,0,0,0,0,0,0,0,5.900973701500334e-05,4.581486791721545e-05,0.9996347427368164,4.275252285879105e-05,6.491391832241789e-05,9.82285855570808e-05,0.0013737065019086003,0.0015631865244358778,0.00012109846284147352,0.00011165244359290227,0.0017563974251970649,0.00012716313358396292,1,0.9996347427368164
118,Asal Usul Padi,37,"Kisah ini menjadi cerita yang melegenda di Tanah Karo, mengajarkan pentingnya kesetiaan, keberanian, dan kebaikan hati dalam menghadapi cobaan hidup.",0,0,0,0,1,0,0,0,0,0,0,0,0.00012305054406169802,5.0598522648215294e-05,0.0004088551504537463,4.07634797738865e-05,0.9991596937179565,9.949540253728628e-05,0.1851281076669693,0.001570872962474823,0.0002265367074869573,9.277043864130974e-05,0.0024665994569659233,0.00011981180432485417,1,0.9991596937179565
119,Baginde Lubuk Gong,5,"Setiap hari, ada saja yang datang untuk melamarnya, namun ayahnya selalu menetapkan persyaratan yang sulit untuk para pelamar tersebut.",0,0,0,0,0,0,1,0,0,0,0,0,6.201512587722391e-05,5.557344775297679e-05,5.90718918829225e-05,4.320603693486191e-05,7.316233677556738e-05,0.00010173823102377355,0.9798828959465027,0.0015594795113429427,0.00011757799074985087,9.002403385238722e-05,0.005253102630376816,0.00019434132263995707,1,0.9798828959465027
119,Baginde Lubuk Gong,16,"Dengan pikiran yang tidak stabil, ia meminta orang-orang untuk menculik Putri Lubuk Gong dan merantainya.",0,1,0,0,0,0,0,0,0,0,0,0,5.317914474289864e-05,0.9988371729850769,6.91324457875453e-05,4.0816114051267505e-05,6.376161036314443e-05,9.642774966778234e-05,0.00029370308038778603,0.0015595433069393039,0.00010385778296040371,8.920350956032053e-05,0.013804269023239613,0.00016149558359757066,1,0.9988371729850769
120,Sabai nan Aluih,3,"Disamping memiliki paras yang cantik, Sabai juga memiliki budi pekerti baik, santun dalam berbicara dan hormat kepada kedua orang tua.",0,0,0,0,0,0,1,0,0,0,0,0,8.632923709228635e-05,4.802042167284526e-05,0.0001243245496880263,4.244087904226035e-05,0.00024538725847378373,0.00010623854905134067,0.876508891582489,0.0015661416109651327,0.00040641517261974514,0.00014911692414898425,0.0032728828955441713,0.00016870663966983557,1,0.876508891582489
120,Sabai nan Aluih,23,Rajo Babanding merasa bahwa sahabatnya itu telah melanggar sopan santun karena berani meminang anak gadisnya secara langsung.,0,0,0,0,0,0,1,0,0,0,0,0,5.680624963133596e-05,5.826847700518556e-05,6.305007264018059e-05,3.9079863199731335e-05,6.363575084833428e-05,9.848952322499827e-05,0.9738749265670776,0.0015592032577842474,0.00011792133591370657,0.00010747790656751022,0.0014056279323995113,0.0002067653986159712,1,0.9738749265670776
120,Sabai nan Aluih,52,Mendidih darah Sabai melihat pembunuh ayahnya tertawa mengejek.,0,1,0,0,0,0,0,0,0,0,0,0,5.372034138417803e-05,0.9967066645622253,6.44733154331334e-05,4.089648791705258e-05,5.9851783589692786e-05,0.0001000381525955163,0.00016032674466259778,0.0015601774211972952,9.779594984138384e-05,9.128588135354221e-05,0.0031856861896812916,0.00021016906248405576,1,0.9967066645622253
121,Asal Usul Danau Maninjau,5,Kisah yang terjadi di Tanjungraya merupakan cerminan dari kehidupan masyarakat Minangkabau yang diatur oleh sistem Petitih ini.,0,0,0,0,0,0,1,0,0,0,0,0,9.451578080188483e-05,5.895478170714341e-05,0.02459903247654438,4.373641422716901e-05,9.686707198852673e-05,9.708688594400883e-05,0.8525446653366089,0.0015608840622007847,0.00014636902778875083,8.929371688282117e-05,0.004954110365360975,0.0005009424057789147,1,0.8525446653366089
121,Asal Usul Danau Maninjau,22,"Sebagai kutukan bagi Bujang Sembilan yang dianggap telah salah dalam menangani perselisihan tersebut, ia pun dikutuk menjadi ikan rayo, yang kemudian mendiami Danau Maninjau.",0,0,0,0,0,0,1,0,0,0,0,0,6.640455831075087e-05,0.00011248662485741079,7.321161683648825e-05,4.070327486260794e-05,6.48953573545441e-05,0.0001764334738254547,0.9447506070137024,0.0015729774022474885,0.0002966543543152511,8.996370161185041e-05,0.005903581157326698,0.0002994989918079227,1,0.9447506070137024
121,Asal Usul Danau Maninjau,28,"Bagi Bujang Sembilan dan para pendukungnya, kutukan yang mereka terima menjadi pengingat akan kesalahan yang telah mereka lakukan, serta konsekuensi dari tindakan yang tidak bijaksana.",0,0,1,0,0,0,0,0,0,0,0,0,6.135149305919185e-05,5.6662014685571194e-05,0.9995410442352295,4.189399624010548e-05,7.686075696256012e-05,0.00020199862774461508,0.44190236926078796,0.0015751461032778025,0.0004983130493201315,0.00011029100278392434,0.002528880024328828,0.00013501722423825413,1,0.9995410442352295
122,Kelingking Sakti,38,"Ia membuktikan bahwa tidak peduli seberapa sulitnya hidup dan seberapa besar rintangan yang dihadapi, dengan tekad dan keberanian, segala hal mungkin tercapai.",1,0,0,0,0,0,0,0,0,0,0,0,0.9994655251502991,4.6562941861338913e-05,7.676963286940008e-05,4.259779962012544e-05,7.082030788296834e-05,0.00010302556620445102,0.0011851951712742448,0.001575090573169291,0.054866012185811996,0.00012152217823313549,0.0015187417156994343,0.0002041221596300602,1,0.9994655251502991
123,Hang Tuah Kesatrai Melayu,31,"Kalianlah yang harus tunduk kepada kami!""",0,0,0,0,0,0,1,0,0,0,0,0,6.152327841846272e-05,4.999470911570825e-05,7.357092545134947e-05,4.191925108898431e-05,0.0001104731927625835,0.00010104780085384846,0.9914626479148865,0.0015623182989656925,0.002823642222210765,9.188482363242656e-05,0.005343958269804716,0.00012675202742684633,1,0.9914626479148865
123,Hang Tuah Kesatrai Melayu,67,"Setelah menyambut keris dan memberi hormat kepada Baginda Raja, Hang Tuah bersilat sambil berseru-seru.",0,0,0,0,0,0,1,0,0,0,0,0,5.081907511339523e-05,5.105534728500061e-05,6.410534115275368e-05,3.887242201017216e-05,6.317434599623084e-05,9.717822103993967e-05,0.9148209691047668,0.001560682663694024,0.0006553352577611804,9.052642417373136e-05,0.0015512775862589478,0.00013171942555345595,1,0.9148209691047668
123,Hang Tuah Kesatrai Melayu,88,Baginda Raja Syah Alam kemudian menitahkan Bendahara Paduka Raja dan Temenggung untuk memimpin pembangunan negeri di Pulau Ledang itu.,0,0,1,0,0,0,0,0,0,0,0,0,6.07176662015263e-05,5.015328497393057e-05,0.987329363822937,4.132636604481377e-05,6.45169202471152e-05,9.704931289888918e-05,0.025994818657636642,0.0015591831179335713,0.00014410699077416211,9.171228884952143e-05,0.0015942559111863375,0.00026755090220831335,1,0.987329363822937
123,Hang Tuah Kesatrai Melayu,240,"Namun, Laksamana Hang Tuah tetap saja menghadap dan memberi hormat kepada Seri Betara.",0,0,0,0,0,0,1,0,0,0,0,0,5.0360238674329594e-05,4.48060964117758e-05,7.466224633390084e-05,3.905579069396481e-05,6.229487917153165e-05,9.68197055044584e-05,0.9639313817024231,0.0015591343399137259,0.0003887068305630237,9.000815771287307e-05,0.0016389302909374237,0.0001598450035089627,1,0.9639313817024231
123,Hang Tuah Kesatrai Melayu,272,Tuah diizinkan tinggal di sebuah rumah milik kerajaan Kampung Bendahara.,0,0,0,0,0,0,1,0,0,0,0,0,6.770384788978845e-05,4.756810812978074e-05,7.049606938380748e-05,3.96073010051623e-05,6.194029265316203e-05,9.887213673209772e-05,0.992061972618103,0.0015602776547893882,0.00010638573439791799,8.937592065194622e-05,0.001512535149231553,0.00017570469935890287,1,0.992061972618103
123,Hang Tuah Kesatrai Melayu,344,permintaan Tuah Sang Laksamana ikut ke Melaka dikabulkan.,0,0,0,0,0,0,0,0,1,0,0,0,6.259381916606799e-05,4.7004356019897386e-05,6.890045187901706e-05,3.990997720393352e-05,6.333317287499085e-05,9.99623371171765e-05,0.0006181720527820289,0.0015581732150167227,0.9837537407875061,9.318875527242199e-05,0.0015424091834574938,0.00016697902174200863,1,0.9837537407875061
123,Hang Tuah Kesatrai Melayu,356,Tuah Sang Laksamana memberi hormat pada Raja Syah Alam.,0,0,0,0,0,0,1,0,0,0,0,0,5.395908374339342e-05,4.483700104174204e-05,0.00011512247147038579,3.964489951613359e-05,6.536395812872797e-05,9.806723392102867e-05,0.9615138173103333,0.0015582339838147163,0.0003080031310673803,9.034222603077069e-05,0.000911372946575284,0.0001758935977704823,1,0.9615138173103333
123,Hang Tuah Kesatrai Melayu,415,"“Aku mengerti maksudmu, tapi aku diperintahkan oleh tuanku.",0,0,0,0,0,0,1,0,0,0,0,0,5.016108843847178e-05,5.638802031171508e-05,6.34845273452811e-05,4.037451435578987e-05,6.194808520376682e-05,9.794432844500989e-05,0.9905911087989807,0.001567324623465538,0.00022518026526086032,8.966779569163918e-05,0.0012470429064705968,0.0002783476375043392,1,0.9905911087989807
123,Hang Tuah Kesatrai Melayu,417,Beberapa prajurit pengawal Kasturi lalu mengeroyok si Jebat.,0,1,0,0,0,0,0,0,0,0,0,0,5.86282076255884e-05,0.9997878670692444,7.286427717190236e-05,4.080334838363342e-05,6.512038089567795e-05,9.728725854074582e-05,0.0001740998704917729,0.0015563464257866144,0.000126434417325072,9.025818872032687e-05,0.0011678688460960984,0.0003413669182918966,1,0.9997878670692444
123,Hang Tuah Kesatrai Melayu,444,"""Daulat Tuanku,” Tuah Sang Pemegang Keris Taming Sari memberi hormat.",0,0,0,0,0,0,1,0,0,0,0,0,5.3740222938358784e-05,4.451852146303281e-05,7.092904706951231e-05,4.033622099086642e-05,6.384203879861161e-05,9.852746734395623e-05,0.9595218300819397,0.0015632512513548136,0.00039673535502515733,8.971200441010296e-05,0.0017361919162794948,0.000193552827113308,1,0.9595218300819397
123,Hang Tuah Kesatrai Melayu,583,"Mendapat laporan itu, Raja Portugis memerintahkan Dong Suala dan Gubernur Portugis di Manila menjadi panglima perang untuk membalas kekalahan atas Melaka.",0,0,0,0,0,0,1,0,0,0,0,0,6.786388985347003e-05,0.002826284384354949,0.0001146671493188478,3.94411945308093e-05,7.042168726911768e-05,9.90140251815319e-05,0.9360867142677307,0.0015626306412741542,0.00021273110178299248,9.013227099785581e-05,0.004935589153319597,0.0001938328059623018,1,0.9360867142677307
123,Hang Tuah Kesatrai Melayu,589,"Mendapat laporan Bendahara, Raja Syah Alam segera memerintahkan untuk meminta bantuan Tuah Sang Laksamana yang saat itu sedang sakit.",0,0,0,0,0,0,1,0,0,0,0,0,5.485667134053074e-05,5.174618127057329e-05,6.624290108447894e-05,3.990856930613518e-05,6.188396946527064e-05,9.731454338179901e-05,0.9501821398735046,0.0015589278191328049,0.0001512010203441605,9.03806576388888e-05,0.0049597760662436485,0.00015531167446170002,1,0.9501821398735046
123,Hang Tuah Kesatrai Melayu,613,Peluru prajurit Melaka berhasil melukai Kapitan Gubernur Portugis.,0,1,0,0,0,0,0,0,0,0,0,0,6.301004032138735e-05,0.9997772574424744,8.486184378853068e-05,4.029658521176316e-05,6.479695730376989e-05,9.816640522331e-05,0.00026906735729426146,0.0015599606558680534,0.00017093535279855132,9.218858031090349e-05,0.0009496503625996411,0.0004153745248913765,1,0.9997772574424744
123,Hang Tuah Kesatrai Melayu,615,"Beberapa saat kemudian, praiurlt berhasil melukai Panglima Dong Suala.",0,1,0,0,0,0,0,0,0,0,0,0,6.407453474821523e-05,0.9996101260185242,6.417372787836939e-05,4.0355345845455304e-05,6.027195922797546e-05,9.636395407142118e-05,0.00018375653598923236,0.0015576123259961605,0.00015632988652214408,9.022306767292321e-05,0.0025752000510692596,0.0025477681774646044,1,0.9996101260185242
124,Kisah Kucing Sang Guru,29,"Aku tidak ingin mengajarkanmu sesuatu yang akan kau gunakan untuk hal yang salah,"" jelas Kucing dengan bijaksana.",0,0,1,0,0,0,0,0,0,0,0,0,5.4458250815514475e-05,5.571485962718725e-05,0.9996065497398376,4.3864147301064804e-05,6.26843684585765e-05,9.77165182121098e-05,0.000742872420232743,0.0015617359895259142,0.00042510798084549606,9.17428988032043e-05,0.002016413724049926,0.00018078158609569073,1,0.9996065497398376
125,Asal Usul Selat Nasi,16,Ia akan menjadi orang yang sangat terhormat dan disegani.,0,0,1,0,0,0,0,0,0,0,0,0,5.663732736138627e-05,4.602505941875279e-05,0.9639376997947693,3.9837996155256405e-05,6.892483361298218e-05,9.78872922132723e-05,0.0002571920049376786,0.0015616740565747023,0.00014163969899527729,0.00019714198424480855,0.0015826555900275707,0.00015327581786550581,1,0.9639376997947693
126,Putri Pandan Berduri,15,Batin Lagoi merawatnya penuh kasih sayang bak anak sendiri dan menganggapnya sebagai pemberian dari Tuhan.,1,0,0,0,0,0,0,0,0,0,0,0,0.9993786811828613,4.718466880149208e-05,6.520868191728368e-05,3.905929406755604e-05,6.53068273095414e-05,9.755992505233735e-05,0.00022722591529600322,0.0015598551835864782,0.00011518265819177032,8.892374171409756e-05,0.001165922381915152,0.00013330989168025553,1,0.9993786811828613
128,Desa Penyalahan Tasikmalaya,3,"Mereka merawat si Loreng sejak ia masih anak-anak, dan hubungan mereka dengan harimau itu semakin kuat ketika mereka memiliki seorang anak.",1,0,0,0,0,0,0,0,0,0,0,0,0.9993483424186707,5.5845186579972506e-05,6.292225589277223e-05,4.1974537452915683e-05,0.00010094523895531893,0.00010114469478139654,0.0001822972553782165,0.0015647545224055648,0.0007843946805223823,0.00010125587868969887,0.002221968723461032,0.00038376619340851903,1,0.9993483424186707
128,Desa Penyalahan Tasikmalaya,33,"Dan karena pengorbanan si Loreng, mereka menjaga dan menghormati keberadaan harimau di desa mereka, mengingatkan bahwa keputusan yang terburu-buru dapat mengakibatkan penyesalan yang besar.",1,0,0,0,0,0,0,0,0,0,0,0,0.9992901086807251,5.462885746965185e-05,0.00011563042789930478,4.2164821934420615e-05,7.163742702687159e-05,0.00021031899086665362,0.0005404544062912464,0.001589191029779613,0.003990278113633394,9.491408854955807e-05,0.002286414848640561,0.00018141913460567594,1,0.9992901086807251
129,Situ Bagendit,16,"Di tengah kemeriahan pesta, Nyai Endit terbiasa memamerkan harta kekayaannya pada rakyat setempat dengan sombong.Pesta yang dia adakan selalu saja mendatangkan perkara lebih besar bagi rakyat.",0,0,1,0,0,0,0,0,0,0,0,0,6.052665412425995e-05,5.6949444115161896e-05,0.8612513542175293,4.034607263747603e-05,6.470453081419691e-05,0.00011538029502844438,0.00026737494044937193,0.0015764711424708366,0.0001240862620761618,0.0001180381077574566,0.00533883273601532,0.00022521504433825612,1,0.8612513542175293
129,Situ Bagendit,25,"Ya Tuhan, berilah kami keringanan atas beban yang kami pikul,” ungkap yang lain.",0,0,0,0,0,0,0,0,1,1,0,0,6.69849687255919e-05,4.505404649535194e-05,6.11498107900843e-05,4.042267028125934e-05,6.440431025112048e-05,9.945158672053367e-05,0.0006934934644959867,0.0015647521940991282,0.6222289204597473,0.9946462512016296,0.0011624968610703945,0.00023191803484223783,2,0.9946462512016296
130,Asal Mula Pancoran,40,"Siapa yang bisa mengangkat tongkat ini, dialah yang berhak menduduki tahta Kerajaan.""",0,0,0,0,0,0,1,0,0,0,0,0,6.69076616759412e-05,5.206236528465524e-05,9.032895468408242e-05,4.0273072954732925e-05,6.996177398832515e-05,9.724273695610464e-05,0.9514272212982178,0.0015624936204403639,0.00015992153203114867,8.982474537333474e-05,0.00937548466026783,0.0004017339088022709,1,0.9514272212982178
131,Si Pitung,4,"Itulah sebabnya, Babah Liem mempekerjakan centeng-centengnya untuk merampas harta rakyat dan menarik pajak yang jumlahnya mencekik Ieher.",0,1,0,0,0,0,1,0,0,0,0,0,7.826969522284344e-05,0.9815688133239746,0.008358387276530266,3.9447815652238205e-05,6.52954913675785e-05,9.984077769331634e-05,0.9780524373054504,0.0015643046936020255,0.0001223282451974228,0.00011344880476826802,0.002215009881183505,0.0006953481351956725,2,0.9815688133239746
131,Si Pitung,52,Schout Heyne menuruti permintaan tersebut.,0,0,0,0,0,0,1,0,0,0,0,0,5.151855657459237e-05,4.2923780711134896e-05,6.372950883815065e-05,3.867725536110811e-05,6.284921255428344e-05,0.00010158149234484881,0.8803910613059998,0.001558897434733808,0.00010513621964491904,9.099760791286826e-05,0.000588992319535464,0.00013367977226153016,1,0.8803910613059998
131,Si Pitung,53,Haji Naipin pun dilepaskan.,0,0,0,0,0,0,0,0,0,0,1,0,5.3664640290662646e-05,4.527810597210191e-05,7.233693031594157e-05,3.879520590999164e-05,6.28959751338698e-05,0.00010036808816948906,0.0006388911278918386,0.0015607987297698855,0.00011744050425477326,9.226545080309734e-05,0.9677417278289795,0.00015618045290466398,1,0.9677417278289795
132,Sungai Jodoh,8,"Merasa kasihan, Mah Bongsu membawa ular tersebut ke rumahnya dan dengan penuh kehati-hatian merawatnya.",1,0,0,0,0,0,0,0,0,0,0,0,0.9987155199050903,4.888546754955314e-05,6.323709385469556e-05,3.928312435164116e-05,6.318169471342117e-05,9.706013952381909e-05,0.000156848895130679,0.0015598254976794124,0.0001150805619545281,9.048862557392567e-05,0.0016238124808296561,0.0001457955368096009,1,0.9987155199050903
133,Si Penyumpit,29,"Saat sumpitnya melukai gadis jelmaan babi itu, Pak Kepala Desa tidak mampu membuktikan kemampuannya untuk menyembuhkannya.",0,1,0,0,0,0,0,0,0,0,0,0,7.924262899905443e-05,0.999609649181366,7.218855898827314e-05,4.055077806697227e-05,6.047889110050164e-05,0.00010027434473158792,0.0002911060000769794,0.0015622787177562714,0.0001578528172103688,9.11732277018018e-05,0.003993600141257048,0.00024468122865073383,1,0.999609649181366
135,Si Parkit Raja Parakeet,7,"Tidak ingin mengabaikan situasi yang serius ini, Raja Parkit dengan bijaksananya mencoba menenangkan para pengikutnya yang gelisah.",0,0,1,0,0,0,0,0,0,0,0,0,9.821584535529837e-05,4.598346640705131e-05,0.9995817542076111,3.907889185938984e-05,6.137214950285852e-05,0.00010028485849034041,0.002327212132513523,0.0015601500635966659,0.0001857853785622865,8.914261707104743e-05,0.0028239863459020853,0.00015250795695465058,1,0.9995817542076111
135,Si Parkit Raja Parakeet,13,"Maka, dengan saran dan arahan dari Raja Parkit, mereka bersama-sama mencari strategi untuk mengatasi ancaman yang mengancam kebebasan dan keselamatan mereka.",0,0,0,0,0,0,1,0,0,0,0,0,0.000115788439870812,0.00010283367009833455,0.0002774118911474943,4.193188578938134e-05,7.416855078190565e-05,0.0001033931621350348,0.9546439051628113,0.0015664009843021631,0.0002577679115347564,9.180591587210074e-05,0.001696352381259203,0.00014675922284368426,1,0.9546439051628113
138,Raden Keling,4,"Tiba di kota Tukang Pantunan, Raden Kuning memberi hormat kepada Ratu Agung.",0,0,0,0,0,0,1,0,0,0,0,0,5.3244802984409034e-05,4.6287656005006284e-05,0.00010423261119285598,3.9645994547754526e-05,6.171335553517565e-05,9.73338246694766e-05,0.9757879376411438,0.0015602866187691689,0.000694864836987108,9.032809612108395e-05,0.0028358986601233482,0.00017888718866743147,1,0.9757879376411438
138,Raden Keling,10,"Kalau demikian, baiklah.",0,0,0,0,0,0,0,0,1,0,0,0,5.1352028094697744e-05,4.58717840956524e-05,0.0009380007395520806,3.952074985136278e-05,6.782184209441766e-05,0.00010070113785332069,0.00016373956168536097,0.0015589776448905468,0.9849641919136047,9.085644705919549e-05,0.0006936652935110033,0.00017977532115764916,1,0.9849641919136047
138,Raden Keling,75,Putri Hitam Manis dan Putri Sinaran Bulan dijadikan tawanan.,0,0,0,0,0,0,0,0,0,0,0,1,5.7498251408105716e-05,4.595663631334901e-05,0.00013686541933566332,4.1312145185656846e-05,6.494698754977435e-05,9.920135198626667e-05,0.00029588714824058115,0.0015602621715515852,9.733736078487709e-05,9.269738802686334e-05,0.0013970681466162205,0.9190436601638794,1,0.9190436601638794
139,Bujang Kurap,29,"""Kau tak usah pergi, aku akan memberikan satu kekuatan kepadamu, tetapi dengan satu syarat engkau tidak boleh kembali ke desa, engkau hams berkelana untuk mengamalkan ilmu yang aku berikan kepadamu.",0,0,0,0,0,0,1,0,0,0,0,0,6.298078369582072e-05,6.999487959546968e-05,6.983712955843657e-05,4.6335750084836036e-05,7.079180795699358e-05,0.0001296020345762372,0.9393115043640137,0.001583742443472147,0.000832237652502954,9.76322335191071e-05,0.0023984620347619057,0.00018305440607946366,1,0.9393115043640137
139,Bujang Kurap,37,"Mendengar berita itu Bujang Kurap mencoba peruntungannya, ia berpikir kalau takdir menghendaki ia mati, ia tidak bisa mengelak.",0,0,0,0,0,0,0,0,1,0,0,0,5.446624709293246e-05,5.118580156704411e-05,6.004753231536597e-05,4.090124639333226e-05,6.117692828411236e-05,0.00010027415555668995,0.010547304525971413,0.0015594222350046039,0.872296929359436,9.063526522368193e-05,0.005154642276465893,0.0007034661830402911,1,0.872296929359436
