story_id,person,aliases,type,sentence_id,text,is_dialogue,count_lexicon,is_subject,is_object
2,Tokoh-1,"['I Angsa', 'Angsa', 'angsa']",Protagonist,7, Kema lantas I Angsa ka Tukad Dangin Desa ditu iya nolih liu ada be,0,1.0,1,1
105,Tokoh-15,"['Kedis-kedise', 'Kedise', 'kedis', 'kedise']",Protagonist,109, Ìh cai kedis tegarang Magending ake ngigelin,0,0.0,1,0
44,Tokoh-2,"['Beli', 'Beli Empas', 'Beline']",Protagonist,25, Yen pakeneh Beline meh melahan i raga ajak makejang makisid uli tlagane ene,0,0.0,1,0
94,Tokoh-13,['prabunidane'],Protagonist,20, Mani semengane mara ida maungu lantas mentik pujer ri prabunidane muah padi di lamben idane,0,0.0,1,0
23,Tokoh-1,"['I Balu Kawanan', 'Beli Kawanan']",Protagonist,22, Masaut I Balu Kawanan Nah amaha ja teken tetanine jani tetani gelahang beli Lantas I Balu Kawanan mulih,0,0.0,1,0
107,Tokoh-16,"['Bli Aji Dharma', 'Beli', 'beli', 'Bli']",Antagonist,23, Wih Bli Aji Dharma to ngudiang Beli kedek padidi Tiang sing suka kedekin Beli buka keto,0,0.0,1,1
86,Tokoh-2,"['meng', 'I Meng', 'Meng', 'adi Meng']",Protagonist,19, I Meng lantas masaut Icang tusing ja ngugu omong ca i ne ento nah melah-melah sub acai nongos dini Icang cendekne suud makasihan teken cai,0,0.0,1,1
72,Tokoh-5,"['Anake agung', 'anake agung ento']",Antagonist,96, Anake agung jengah tuara karunguang lantas sahasa makecog,0,0.0,1,0
54,Tokoh-1,['I Kerug'],Antagonist,51, SAPLAR Pipisne I Kerug telah Duang dasa lemeng l Kerug maplalian dogen tusing inget mulih,0,0.0,1,0
120,Tokoh-2,"['I Kekua', 'I kekua', 'Kekua', 'kekua']",Antagonist,72, liunan jani iraga maan be bandingan tekan bene I Kekua,0,0.0,1,1
94,Tokoh-1,"['Ida Sang Prabu Daha', 'Ida Sang Prabu', 'Sang Prabu', 'Ratu Sang Prabu']",Antagonist,29, Disubanne kuningang keto lantas Ida Sang Prabu ngandika ngalih anake tua ento sig umah Men Bekunge,0,4.0,1,1
51,Tokoh-1,"['I Keker', 'Keker', 'I keker']",Protagonist,58, Jani I Keker pesu kenehne ngwalesin kacorahan I Lutunge dugas kampidne kabutbut,0,0.0,1,1
13,Tokoh-2,"['Bojog lua ento', 'I bojog lua']",Antagonist,46, Kedis makeber tur ngucaci girang ningalin i bojog lua,0,0.0,1,0
27,Tokoh-2,"['memene', 'Me', 'meme', 'Meme', 'i meme', 'memenne', 'memene I Belog']",Protagonist,55, Kacerita jani suba teka memene tengkejut ia ngadek bo bengu maimbuh andih cara mabo banyeh anak mati,0,-4.0,1,0
37,Tokoh-1,"['I Cicing Gudig', 'Cicing Gudig', 'Cicing gudig']",Antagonist,42, kacerita jani I Cicing Gudig kapurukang malajah masastra,0,0.0,1,1
72,Tokoh-1,"['I Ubuh', 'U-buh', 'Ubuh']",Protagonist,8, Jani I Ubuh suba matuuh sawatara nem tiban,0,0.0,1,1
48,Tokoh-8,"['I Rare Angon', 'I Rare angon']",Antagonist,6, Rasa sing sida baan ngerasayang sakite dini ngadenang suba icang mati teken nandang sakit buka kekene Disubane ningeh munyi I Kasiape Kepuh buka keto masaut lantas I Goak Nah ne jani ada pangupayan icange teken cai apange cai rahayu tur I Rare angon suud ngusak asik cai dini,0,-1.0,1,1
30,Tokoh-1,['Pan Meri'],Protagonist,13, Diastun tuah aukud turin bengil sakewala mawiguna pesan marep Pan Meri,0,0.0,1,0
53,Tokoh-4,"['I Lelipi Raja', 'I Lelipi']",Antagonist,53, I Lelipi Raja tan mari ka desa-desa ngalih tetedan,0,0.0,1,1
105,Tokoh-11,"['Me Lutung', 'I Lutung', 'Lutung', 'Men Lutunge', 'I Lutunge', 'meme Lutung', 'me Lutung']",Protagonist,283, Ada lantas parekane ngaturang I Lutung suba mati krah cicing,0,-4.0,1,1
39,Tokoh-2,"['I Macan', 'Macan']",Antagonist,25, Tur Sampi mamunyi kene Yen kai mula menehang Cai Macan,0,0.0,1,0
79,Tokoh-2,"['I Cekcek', 'cekcek', 'Cekcek']",Antagonist,1,Ada tuturan satua I Kidang teken I Cekcek,0,0.0,1,1
6,Tokoh-1,"['I Nyoman Jater', 'I Nyoman jater', 'Nyoman Jater']",Protagonist,63, Nah suba lantasan sanja teka I Nyoman Jater uli umane laut ia ka paon nyemak nasi,0,0.0,1,1
12,Tokoh-3,"['I Bintang Lara', 'Bintang Lara', 'I Bintang Larane', 'adi Bintang Lara', 'adi', 'I adi', 'Adi Bintang Lara', 'Adi']",Protagonist,122, Di subane ilang tabuan buin I Bintang Lara kandikain ngalih lelipi apanga ngajak panak tetelu tur gedene apang lamun katungane tur apang tegakine teken I Bintang Lara,0,0.0,1,1
57,Tokoh-1,"['I Langgana', 'langgana', 'Langgana', 'I Langganane']",Protagonist,32, Keto I Langgana masaut,0,0.0,1,1
58,Tokoh-1,['I Lara'],Protagonist,8, Maan dong kote Nah suba jani keto I Lara kapah-kapah pesan nawang jumahne pepesan ia di pisaga magarapan dumulihne suba sanje dapetanga umahne suung mapa peteng dingdeng sepi litig ludin sing madamar kenken ja jeron dewane mungmung sajan,0,0.0,1,0
60,Tokoh-6,"['I Kunang-kunang', 'Kunang-kunang']",Antagonist,18, Jadi aliha I Kunang-kunang tur katakonin Ih Iba Kunang-kunang nak ngudiang Iba indeng-indeng ngaba api Iba ane makrana I Blatuk nepak kulkul,0,3.0,1,1
78,Tokoh-4,"['beline', 'beli', 'Beli']",Protagonist,23, Kerana beli mamunyi keto apang edanan nyai bas kelajuk sebet,0,-3.0,1,1
105,Tokoh-2,"['Ida Raden Galuh Daha', 'I Nanak Galuh', 'Raden Galuh', 'Ida Raden Galuh', 'Raden Galuhe', 'Raden Galuh', 'Galuh Daha', 'raden galuh', 'I Raden Galuhe', 'I Radem Galuh', 'i raden galuh', 'ratu Raden Galuh', 'galuh Daha', 'I Galuh Daha']",Protagonist,32, kacerita suba Ida Raden Galuh malinggih di gowok I Sampine di bongkol abinge,0,0.0,1,1
42,Tokoh-6,"['kedis curik lue muani', 'I Curik ane muani', 'curike ane luane', 'curike ane muani', 'jrone kedis curik', 'jrone', 'kedise', 'I kedis curik']",Protagonist,107, Masaut I Curik ane muani Ento tawang nguda sing,0,0.0,1,0
96,Tokoh-1,"['Pan Angklung Gadang', 'Bapa Angklung Gadang', 'Pan Angklung Gadange', 'Angklung Gadang', 'I Angklung Gadang']",Antagonist,102, Dening keto makejang adung parembugan krama banjare lantas mrerod pada teka kumah Pan Angklung Gadange,0,0.0,1,0
106,Tokoh-4,['I Babah Sampik'],Protagonist,27, Budal raris I Babah Sampik ka Bociu Kuta tur punika pinaka jalaran nyane ipun sinangkaon utawi sungkan kayun tur ngemasin padem utawi seda,0,-1.0,1,0
99,Tokoh-14,"['bikule', 'bikul', 'I bikul', 'bikule totonan', 'bikul', 'bikule ento']",Antagonist,11, Nengked bedanginan nepukin anak ngaba bikul buin lantas ngomong kal kija ngabe ngabe bikul Bakal kutang tiang keto pesautne anake totonan,0,1.0,1,1
15,Tokoh-3,"['I raksasa', 'I Raksasa', 'Raksasane']",Protagonist,16, Raksasane dadi Bhatara tur mawali buin ka Suarga,0,0.0,1,0
20,Tokoh-13,"['raden galuh', 'Raden Galuh', 'Raden Galuh Pitu', 'galuh pepitu', 'Galuh Pitu', 'Ida Raden Galuh', 'Raden Galuh pitu', 'galuh pitu punika', 'Raden Galuh ajaka papitu', 'Raden Galuh makasami', 'Raden Galuh Pitu makasami']",Antagonist,59, Kendel pesan pakayunane Raden Galuh makasami,0,0.0,1,1
94,Tokoh-1,"['Ida Sang Prabu Daha', 'Ida Sang Prabu', 'Sang Prabu', 'Ratu Sang Prabu']",Antagonist,50, Ditu lantas prajani Ida Raden Galuh ajaka ka puri antuk Sang Prabu miwah prameswari,0,0.0,1,0
66,Tokoh-2,"['I Polos', 'Polos']",Protagonist,19, Buin manine teka sajan I Polos kaumahne,0,0.0,1,1
98,Tokoh-2,"['Men Jempenit', 'Men jempenit']",Antagonist,46, Suba keto jemaka lantas mase ambul sendine tur tundena Men Jempenit ka peken meli kamben baju muah ane len-lenan,0,0.0,1,1
37,Tokoh-1,"['I Cicing Gudig', 'Cicing Gudig', 'Cicing gudig']",Antagonist,19, I Cicing Gudig lantas kandikaang dadi Patih tur I Cicing Gudig ngiring,0,0.0,1,1
98,Tokoh-13,"['i bikul', 'bikul']",Protagonist,79, Tepukina lantas tur pongponga petine ban i bikul,0,0.0,1,1
113,Tokoh-7,['I Kala Mertiyu'],Protagonist,11, minab jejeh I Kala Mertiyu mgantenang kaaengan tang i raksasa Wirada punika,0,-3.0,1,0
36,Tokoh-1,"['I Celempung', 'Celempung']",Antagonist,44, Disubane makejang pada makumpul ditu I Celempung masuang dayane ane lengit,0,0.0,1,1
42,Tokoh-3,"['I Donglen', 'Gede Donglen']",Protagonist,134, Icang nyaman Luhe ne malu I Donglen,0,0.0,1,0
39,Tokoh-2,"['I Macan', 'Macan']",Antagonist,49, Kacerita ne jani kalahina I Macan teken I Kancil ngajak I Cita,0,-4.0,1,1
96,Tokoh-9,"['kulukne', 'Kuluk', 'kuluk', 'kuluke']",Antagonist,63, Dadiannya dot I Wayan Sebetan teken kulukne ento laut kadesekin Pan Angklung Gadang,0,0.0,1,0
93,Tokoh-1,"['sang nata Prabu Aiswaryadala', 'ida Sang Prabu Aiswaryadala', 'sang prabu Aiswaryadala', 'Aiswaryadala']",Protagonist,25, Benjangane semeng dane Ni Diah Tantri raris katur ka puri ring sang prabu Aiswaryadala,0,0.0,1,1
14,Tokoh-4,"['ula aya ageng pisan', 'ula aya punika', 'ula ayane punika', 'Ula ayane punika', 'ulane punika', 'ula']",Antagonist,29, Disubane neked ditengahing bet dapetange ulane punika padem,0,0.0,1,0
119,Tokoh-2,"['yuyu punika', 'yuyune punika', 'Yuyune punika', 'I Yuyu', 'I Yuyune']",Protagonist,5, Kasuen-suen sampun ageng yuyu punika,0,5.0,1,0
60,Tokoh-10,"['I Lelipi', 'Lelipi']",Protagonist,51, Yen ada Lelasan masiat ajaka Lelipi maan I Lelasan makipu di tain sampine sinah ia tusing kalah baana teken I Lelipi,0,0.0,1,1
115,Tokoh-2,"['Ni Luh Lancah', 'Luh Lancah', 'Luh LAncah']",Antagonist,61, Ngembos Luh Lancah laut ngamelmel Ne kenken I Saa-sangkur Bulune paling kedasa putih,0,0.0,1,1
12,Tokoh-7,"['memene', 'Meme', 'meme', 'me']",Antagonist,17, ceritayang Men Bekunge sing ja tulak teken pakayunan Ida Anake Agung tur kakaukin pianakne Cening Cening Bintang Lara jani Cening kasengan teken Ida Anake Agung kapandikaang tangkil ne jani Cening sing ke ngelah kasisipan teken Anake Agung Masaut I Bintang Lara Meme icang sing ja apa inget taen sisip teken Ida Anake Agung keto pasautne I Bintang Lara lantas ia majalan ngapuriang atehanga teken parekane,0,0.0,1,1
67,Tokoh-5,"['I Kedis Perit', 'Prit', 'I Perit']",Antagonist,8, I Kedis Perit miwah I Kedis Curik paling demen matinggah di tundunne I sampi,0,3.0,1,0
80,Tokoh-2,"['I lutung', 'I Lutung']",Antagonist,3, I lutung mideran nabdabang kekertan jagat,0,0.0,1,1
2,Tokoh-2,"['I Kerkuak', 'Kerkuak', 'kerkuak']",Antagonist,40, Madaya I Kerkuak nunden I Angsa tuun ngalih be sik kolamne Pan Berag we Angsa cai dueg ngelangi kemu tuun juk bene di kolame,0,4.0,1,1
93,Tokoh-10,"['ajine', 'Ajindane']",Protagonist,21, Ajindane maridartayang saindik-indik,0,0.0,1,0
44,Tokoh-7,"['Embok Angsa', 'Embok']",Protagonist,22, Beli Empas ajak Beli muah Embok Angsa Awinan masan panese makelo pesan tur tuara taen ujan ento awinan yeh tlagane ngangsan nyat,0,-5.0,1,1
108,Tokoh-2,"['Sang Aji Saka', 'Aji Saka']",Protagonist,5, Majalaran antuk kawentenane sapunika minab sampun sangkaning kaagungan Hyang Parama Kawi raris Ida nyupat jagat Majeti antuk ngariptayang manusa mautama sane mapesengan Sang Aji Saka,0,0.0,1,1
48,Tokoh-3,"['I Lelipi', 'lelipi']",Antagonist,28, Tumuli nimbal I Lelipi Masaut bangras nah yen tuah cai lege masuwitra ngajak kai ane jani serahang ento taluhne I Goak neked panak-panak ia teken kai,0,0.0,1,1
98,Tokoh-1,"['Pan Jempenit', 'pan jempenit', 'Pan jempenit']",Protagonist,49, Suba keto nganggo sarwa anyar lantas Pan Jempenit beh kendelne dening tumben nganggo anyar tur malali-lali lantas Pan Jempenit,0,0.0,1,1
81,Tokoh-1,"['I Lutung', 'Lutung']",Antagonist,6, Beduda beh amah-amahan pikir cai kanti beregidig keto apo jo ado keto gen kanggoang mapo yo Lutung Mih patuhang awak cai jak wake yo dugas wake nu di kota nak biaso roti lapis jak stek sampi nawang Beduda Bo yo keto ngujang cai mai kealase Sing dempelang nae awak caine ditu di kota Lutung Yee di kota lamun ado punyan kayu gede miwah liu amah-amahan jaan nyen nawang di alase liu ado punyan kayu gede sing liunang yo ado amah-amahan jaan,0,6.0,1,0
23,Tokoh-2,['I Balu Kanginan'],Antagonist,27, Sawireh tungkedne suba kaentungang di natahe tetanine suba telah amaha ban siapne I Balu Kanginan,0,0.0,1,0
31,Tokoh-1,"['I Belog', 'belog']",Antagonist,18, Disubana I Belog neked jumahne ajinanga baan memene tuara ngaba bebek,0,-5.0,1,1
96,Tokoh-1,"['Pan Angklung Gadang', 'Bapa Angklung Gadang', 'Pan Angklung Gadange', 'Angklung Gadang', 'I Angklung Gadang']",Antagonist,32, Sakadi mangkin Cokor I Dewa makoratan bacin Cokor I Dewa anyud ngatebenang manah titiange mangda rauhing tain titiange taler bakti ngiring bacin Cokor I Dewa keto aturne Pan Angklung Gadang kandugi ica Ida Anake Agung nuli ngandika Nah Pan Angklung Gadang jani kema suba mulih suud suba iba mamarekan teken gelah Suba kone keto kacerita jani Pan Angklung Gadang nongos di Desa Anu ngajak kurenannya tur ngelah kuluk berag abesik,0,5.0,1,1
11,Tokoh-5,"['Ida Dang Guru', 'Dang Guru', 'dang guru', 'Dang guru', 'dang gurujati']",Protagonist,8, Wantah patut pangandikan Dang Guru inggih titiang misadia jagi nglaksanayang sapituduh Ida,0,4.0,1,1
27,Tokoh-3,"['kurenane', 'Kurenanne', 'knurenane', 'Kurenan I Beloge']",Protagonist,80, Makelo-kelo lusina tlana I Belog ban kurenane gisianga gelahne kanti kenceng cara uyung laut celepanga ka songne mawastu dias-diis ajaka dadua cara anak naar rujak cara anak kasakitan sawireh misi aduh-aduh misi siyut-siyut,0,-5.0,1,0
36,Tokoh-3,"['Kelian banjar', 'Jro Kelian Banjar', 'jro kelian', 'Jro kelian', 'jero kelian', 'jrone', 'jro kelian banjar']",Antagonist,83, Inggih jero kelian jinah jrone jagi waliang titiang sakemaon cicing tiange ulihang dumun,0,0.0,1,1
61,Tokoh-1,"['I Karitaka', 'Sang Karitaka']",Antagonist,3, Kacerita liu panak katake pasliwer ditu nyiwiang ratun katake ane madan I Karitaka,0,1.0,1,0
115,Tokoh-5,"['I Grungsung', 'I Grungsang', 'I grungsang']",Protagonist,87, I Selem ajak I Biing noltol jagung dampingane baan I Grungsang,0,0.0,1,1
29,Tokoh-1,"['I Belog', 'Belog']",Antagonist,9, I Belog lantas morahan teken memenne Meme meme icang ngarorod ajak anak luh jegeg pesan,0,-3.0,1,1
37,Tokoh-1,"['I Cicing Gudig', 'Cicing Gudig', 'Cicing gudig']",Antagonist,36, Nyanan petengne mabakti kone buin I Cicing Gudig di Pura Dalem mapinunas apang dadi okan Anak Agung,0,3.0,1,1
96,Tokoh-1,"['Pan Angklung Gadang', 'Bapa Angklung Gadang', 'Pan Angklung Gadange', 'Angklung Gadang', 'I Angklung Gadang']",Antagonist,127, Dadi prajani I Giur dot teken tungked Pan Angklung Gadange,0,0.0,1,0
67,Tokoh-7,"['I Kedis Goak', 'I Goak', 'Goak']",Antagonist,48, Nanging ia nawang ane ngelah munyi seret ento tuah I Goak,0,0.0,1,1
27,Tokoh-1,"['I Belog', 'Belog']",Antagonist,73, Kacerita ngraos kurenane Wih Bli enggalang anake menek Beli enggalang menek apang enggalan ngelah pianak Mara keto munyinne ane luh jeg ngenggalang I Belog menek ka lenggatane saksak-siksik patigradab tusing ada ane seken aliha,0,-5.0,1,1
101,Tokoh-2,['Jro Kelihan Desa'],Protagonist,15, Yening sampine manakan kaping pindone dadi gelah Jro Kelihan Desa,0,0.0,1,0
60,Tokoh-8,"['I Sampi', 'Sampi']",Protagonist,31, Ne jani I Sampi wenang dadi tetadahan Sang Raja Sangmong,0,0.0,1,1
74,Tokoh-1,"['I Jayaprana', 'Jayaprana', 'I Jayaprna', 'I jayaprana', 'Jayaprane']",Protagonist,18, Sesampune Jayaprana ring jeroan jero bendesa Jayaprana ngaturang ngaturang sualapatra punika kaping Jero bendesa,0,0.0,1,0
37,Tokoh-1,"['I Cicing Gudig', 'Cicing Gudig', 'Cicing gudig']",Antagonist,47, Buin kemplangina tur pasangetina buin kone I Cicing Gudig makoangan,0,0.0,1,1
17,Tokoh-5,"['I krama lenan', 'krama desane', 'krama desa', 'Krama desa']",Antagonist,94, Dadong keto masih krama desa ajak makejang,0,0.0,1,1
9,Tokoh-1,"['I Belog', 'Belog']",Antagonist,31, Ngomong lantas I Belog ngaluedang Meme yen anake mati bengu bonne Masaut Memenne Aa bengu,0,-8.0,1,1
23,Tokoh-1,"['I Balu Kawanan', 'Beli Kawanan']",Protagonist,58, Sabilang ngeling anake cerik jemaka baan I Balu Kawanan,0,0.0,1,0
71,Tokoh-2,"['kurenane', 'Kurenane']",Protagonist,6, Kurenane beling gede lantasan aji nyampatang taine selid sanja dogen suba keweh,0,2.0,1,1
16,Tokoh-1,"['Cicing Alas', 'I Cicing Alas']",Antagonist,4, Cicing Alas negak di beten punyan kepuh,0,0.0,1,0
109,Tokoh-4,"['Sang Bima', 'Cening Sang Bima', 'Ida Sang Bima']",Protagonist,53, Jani ngwales Sang Bima ngabut kayu kadadiang gada anggona nigtig I Raksasa Baka,0,0.0,1,0
103,Tokoh-8,"['jerone', 'Jerone']",Antagonist,20, Widiadari Nilotama tan panjang pangandikanne dening sampun tuduh Sanghiang Wisesa cendek pangandikanidane Inggih upaminipun kebo saking baneh ngranjing ring pabianan anak wenang jerone nahan sakewanten pinunas titiange mangda sakayang-kayang jerone sampunang tulak ring pituduh tiange sane patut,0,4.0,1,1
23,Tokoh-3,"['Beli Wayan', 'Beli', 'Bli', 'beli', 'bli']",Protagonist,35, Nah mati teteh celeng ya siap beline jani celeng ya gelahang beli keto I Balu Kawanan,0,-4.0,1,1
68,Tokoh-1,"['I Sangging Lobangkara', 'Sangging Lobangkara']",Protagonist,3, Ngandikan Ida Bhatara O krana gelah nunden cai tangkil gelah nunden cai gaenang gelah puri apalebah tur apang misi togog I Sangging Lobangkara sariring,0,0.0,1,1
1,Tokoh-1,"['Pan Karsa', 'Pan Karta']",Antagonist,9, Apeteng Pan Karsa tusing bisa pules ngenehang gegaene,0,0.0,1,0
73,Tokoh-6,['Cening'],Protagonist,33, Bapa suba nawang Cening sewai-wai makena bubu dini tur Cening mula tuah setata jemet magarapan,0,4.0,1,0
42,Tokoh-3,"['I Donglen', 'Gede Donglen']",Protagonist,78, I Donglen masangke gelem atinne won awakne sakit tur dingin buina Ia tusing bani teken damar tundene ngendiang damare ngaba pesuan,0,2.0,1,0
52,Tokoh-2,"['I Blanguyang', 'asu Blanguyang', 'I Blangyang']",Antagonist,21, Disubane I Blanguyang mati wau Ida Sang Prabu eling ring raga kangen tekening I Blanguyang mati,0,-8.0,1,0
120,Tokoh-11,"['I Udang', 'udange']",Protagonist,104, Ditu lantas I Yuyu ngajak I Udang bareng ngamiletin sewamara,0,0.0,1,0
40,Tokoh-1,['I Clalongan'],Protagonist,19, I Clalongan ngenggalan makeber nambung wireh tusing kena bedil,0,3.0,1,0
23,Tokoh-2,['I Balu Kanginan'],Antagonist,48, Kacerita ada sawatara dasa dina I Balu Kawanan tusing taen kema ka umah I Balu Kanginan baase ento suba telah baana nyakan teken I Balu Kanginan,0,0.0,1,0
21,Tokoh-1,['I Getap'],Protagonist,33, I Getap kesiab makraikan geleh tur takut,0,-3.0,1,0
102,Tokoh-1,"['I Kedis cangak', 'I Kedis Cangak', 'Sang Cangak', 'sang cangak', 'Sang cangak', 'sang cangake']",Antagonist,28, Sarauhe ring genah sane katuju i yuyu akeh ngantenang tulang tulang ulam ring duur watune genang sang cangake sering mamangsa soroh ulame,0,4.0,1,0
24,Tokoh-4,"['I Temisi', 'Temisi']",Antagonist,25, Lantas I Blatuk ngomong kene Uh ne ko sedeng melaha I Temisi tepukin icang dini,0,1.0,1,1
2,Tokoh-2,"['I Kerkuak', 'Kerkuak', 'kerkuak']",Antagonist,8, Makeneh lantas I Angsa ngajak I Kerkuak kema ka Tukad Dangin Desa ngalih amah-amahan,0,0.0,1,1
96,Tokoh-1,"['Pan Angklung Gadang', 'Bapa Angklung Gadang', 'Pan Angklung Gadange', 'Angklung Gadang', 'I Angklung Gadang']",Antagonist,16, Mara ajinanga teken Pan Angklung Gadang lantas encol ia manuduk tur kapenpen di kompek pacanangane tur kategen laut majalan,0,0.0,1,1
116,Tokoh-1,"['I Siap Selem', 'I Siap selem', 'Siap Selem']",Protagonist,3, Sawai-wai I Siap Selem ngalih amah nganti ke dauh pangkunge,0,0.0,1,1
24,Tokoh-7,"['I Sampi', 'Sampi', 'I Sampine']",Antagonist,63, I Sampi lantas ngamulihang makire lakar nangkil,0,0.0,1,1
29,Tokoh-1,"['I Belog', 'Belog']",Antagonist,40, I Belog lantas ngomong Meme meme nguda bengu bone jenenga meme mati,0,-8.0,1,1
32,Tokoh-2,"['Semal', 'I Semal']",Antagonist,8, Kacerita sebilang wai I Semal ngintipin anake ane mempen susu di jedinge,0,0.0,1,1
118,Tokoh-1,['I Aget'],Protagonist,58, Ditu laut makejang pada nyumbah I Aget tur makejang ngidih urip tekening ia,0,0.0,1,0
79,Tokoh-2,"['I Cekcek', 'cekcek', 'Cekcek']",Antagonist,35, Di subane neked di punyan kayune ngomong lantas I Cekcek ih iba Kidang jani sawireh makapindo iba kalah malomba men kenken iba inget teken pasobaya Masaut I Kidang Nah cai Cekcek kai inget pesan teken janji dening kai saja kalah baan iba da iba nampah kai,0,1.0,1,1
23,Tokoh-2,['I Balu Kanginan'],Antagonist,16, Buin telunne mara I Balu Kawanan kema nganggur capatina teken I Balu Kanginan ia Beli Wayan mara teka,0,0.0,1,0
99,Tokoh-11,"['pandene', 'Pandene', 'pandene ento']",Antagonist,61, Pandene sube medem,0,0.0,1,1
98,Tokoh-15,"['i cicing', 'cicing', 'I cicing']",Protagonist,141, cicing da jani kai matianga buin pidan lamun kai suba ngelah pianak yan bakat bani banying panak kaine amah ja,0,2.0,1,0
44,Tokoh-13,"['kuluk medem ajaka dadua', 'kuluk luh muani', 'kuluke muani']",Protagonist,48, Tegarang melahang nlektekang pasaut kuluke muani sambilang muaban kiap wireh sedukan,0,3.0,1,0
74,Tokoh-5,['I Saunggaling'],Antagonist,48, Sesampune I Saunggaling mapiorah ring I Jayaprana raris ipun ngiringang napi sane kabaosang olih anake agung saking manah tan becik miwah sedih ipun nancebang keris ring ulu ati Jayaprana,0,0.0,1,0
77,Tokoh-4,"['I Bojog', 'Bojog']",Antagonist,43, I Bojog bragedegan,0,0.0,1,1
24,Tokoh-5,"['I Kunang-Kunang', 'Kunang-Kunang', 'I Kunang-kunang']",Antagonist,31, Santukan parekan palungguh Cokor I Dewa ipun punika I Kunang-Kunang setata ileh-ileh ngaba api,0,0.0,1,1
120,Tokoh-1,"['I Lutung', 'Lutung', 'lutung', 'I lutung']",Antagonist,103, Gelisin cerita makejang kone panjake tusing nyidayang ngejuk I Lutung,0,0.0,1,1
61,Tokoh-2,"['I Lelipi Gadang', 'Lelipi Gadang', 'lelipi gadang gede', 'I Lelipi']",Antagonist,35, Jani I Lelipi mapi-mapi dadi sang sadhu satia teken swadharmane dadi parekan sarwe katake ane ada di tlagane ento,0,0.0,1,0
34,Tokoh-8,"['manusa', 'manusane', 'I manusa']",Antagonist,14, Awake tuara pesan ngugu petan ibane keto ngorahang manusane tuara bisa ngwales tresnan anak,0,0.0,1,0
110,Tokoh-3,['Sang Lanjana'],Protagonist,34, Buina tuara merasa tendasne tinggahina baan Sang Lanjana mapan Sang Lanjana madewek kedis cerik,0,0.0,1,0
44,Tokoh-3,"['empase ane lua', 'empas lua', 'Empas Lua', 'i empas lua', 'I Empas lua', 'Luh', 'empase luh']",Protagonist,23, Nah jani kenken baan madaya keto I Empas lua ngomong sada sedih sungsut,0,-4.0,1,1
26,Tokoh-1,['I Belog'],Antagonist,3, Ri sedek rahinan Tilem gumine peteng detdet I Belog nyelisib di durin gedong sanggahne Luh Sari,0,-5.0,1,0
64,Tokoh-1,"['I Lutung', 'Lutung', 'Tung', 'I utung']",Antagonist,29, Men kenken I Lutung nakeh I Kekua pasti mati matunjel,0,-4.0,1,1
96,Tokoh-1,"['Pan Angklung Gadang', 'Bapa Angklung Gadang', 'Pan Angklung Gadange', 'Angklung Gadang', 'I Angklung Gadang']",Antagonist,98, Buin maninne palimunan Pan Angklung Gadang nampah lantas nglawar,0,0.0,1,1
96,Tokoh-1,"['Pan Angklung Gadang', 'Bapa Angklung Gadang', 'Pan Angklung Gadange', 'Angklung Gadang', 'I Angklung Gadang']",Antagonist,121, Buin Pan Angklung Gadang nuduk tungkedne,0,0.0,1,1
64,Tokoh-1,"['I Lutung', 'Lutung', 'Tung', 'I utung']",Antagonist,34, Tung yen suba icang ada di tengah semere bang malu icang miasa akejep lakar mesuang kesaktian icange,0,0.0,1,0
64,Tokoh-1,"['I Lutung', 'Lutung', 'Tung', 'I utung']",Antagonist,30, Tusing misi makeneh I Lutung manyanggupin,0,0.0,1,1
105,Tokoh-8,"['I Sampi Wadak', 'I Sampi', 'Jro Sampi', 'I Sampine', 'Sang Sampi', 'Sampi', 'I sampi', 'I sampi wadak', 'sampi wadak', 'I Sampi Wadake']",Protagonist,94, Ngembo kone I sampi laut mati,0,-4.0,1,1
41,Tokoh-1,"['I Congeh', 'Congeh']",Protagonist,5, I Congeh uli mara kepit paningalane semengane ento nadak sara tindakannyane setata paling turin setata apa ane jemaka nadaksara ulung,0,0.0,1,1
26,Tokoh-1,['I Belog'],Antagonist,10, Buin lantas I Belog masuara Wih Kita Damuh sing dadi ngaba damar yening lakar nyembah Ida Betara Sawireh Manira maraga piningit tan arsa galang-galang paling melah enggjalang ngae sodan rayunan,0,0.0,1,0
12,Tokoh-12,"['Ni Cili', 'Cili']",Antagonist,80, Matakon lantas Ni Cili Adi Adi Bintang Lara suba gede kedise Ungkabanga lantas sibuh mase balihina gagak petake mara kone tumbuh bulu,0,2.0,1,1
12,Tokoh-15,"['Dewi Supraba', 'dedari Supraba', 'Ida Dedari Supraba', 'Ni Supraba', 'Ni supraba', 'dedari Suprabane']",Protagonist,55, Dewi Supraba nu kone kayeh ajaka dadua,0,0.0,1,0
42,Tokoh-1,"['Ni Luh Arum', 'Ni Luh Arume', 'Luh Arume', 'Luh Arum', 'Luh', 'Luh arum']",Antagonist,39, Suba das lemah I Donglen ngamaluin bangun Luh Arum nu pules,0,0.0,1,1
88,Tokoh-1,"['Pan Brayut', 'De Brayut']",Protagonist,10, Kacerita jani Pan Brayut kayehan mandus tur mambuh tur masisig,0,1.0,1,0
81,Tokoh-1,"['I Lutung', 'Lutung']",Antagonist,1,Ada kone katuturan satua I Lutung,0,0.0,1,1
63,Tokoh-1,"['I Lengar', 'Lengar', 'I Lengar paing keliha', 'I Lengar paling keliha', 'Ane paling keliha']",Protagonist,25, Sesubane I Lengar paling keliha neked di basetengahan punyan buahe laut punyan buahe gejoranga,0,0.0,1,1
114,Tokoh-3,['I Sidem'],Antagonist,54, Nanging I Sidem nyantulin munyinne I Semut Api,0,0.0,1,0
117,Tokoh-2,"['memene', 'meme', 'i meme', 'memenne', 'Meme', 'Memenne', 'memenne I Ketimun Mas', 'Men Ketimun Mas']",Protagonist,42, Kadena saja memenne teka,0,0.0,1,1
22,Tokoh-1,"['I Kedis Puuh', 'I Puuh']",Protagonist,5, Sakewala tongos sebunne ento di sisin tegalanne dadi aluh anake nyeluk yen semengan wiadin sanja I Kedis Puuh ada ditu,0,0.0,1,0
54,Tokoh-1,['I Kerug'],Antagonist,22, I Kerug suba ditu bareng magasal macok manemin ngajak botohe ane lenan,0,0.0,1,0
10,Tokoh-2,"['panjake', 'Panjake', 'panjak', 'panjaki dane']",Protagonist,28, Tur ngadikayang panjake apang ngae pakubon,0,0.0,1,1
5,Tokoh-3,"['I Tumtum', 'Tumtum']",Protagonist,9, I Tumtum raris merika ring batan wit kepuhe negak masila raris ipun mesesangi,0,0.0,1,1
71,Tokoh-7,"['meme', 'Meme', 'memene', 'memen anake cerik ento', 'memen anake cerik']",Protagonist,35, Kacerita jani selid sanja kone delokina anake cerik teken memene panyonyoina dogen suud keto ngenggalang kone ia mulih,0,0.0,1,0
107,Tokoh-2,"['Ida Sang Prabhu', 'sang Prabhu', 'Sang Prabhu', 'Sang Prabu', 'Ida Sang Prabu', 'Dewa Sang Prabhu', 'I Dewa']",Antagonist,14, Uduh Dewa Sang Prabhu yukti kalintang wicaksana I Dewa ngambel jagat,0,5.0,1,1
78,Tokoh-1,"['Gajah ageng', 'I Gajah']",Antagonist,7, Yan tuara mati baan beli musuh idewane ia I Gajah adayan beli ngemasin mati ketimang idup dadi kakedekan,0,-8.0,1,0
72,Tokoh-1,"['I Ubuh', 'U-buh', 'Ubuh']",Protagonist,88, I Ubuh milu masih paek mabalih ditu,0,0.0,1,1
