story_id,person,aliases,type,sentence_id,text,is_dialogue,count_lexicon,is_subject,is_object
2,Tokoh-2,"['I Kerkuak', 'Kerkuak', 'kerkuak']",Antagonist,11, Disubane neked di Tukad Dangin Desa ditu lantas I Kerkuak nolih liu ada be pesu lantas daya corah ne I Kerkuak yen ne dum ajak I Angsa sinah lakar bedik icang maan ngamah krana basang icange cenik jeg liunan I Angsa maan ngamah krana awakne gede liu ngidaang ngamah be,0,5.0,1,1
55,Tokoh-2,"['I Macang Poleng', 'I Macan']",Antagonist,80, I Kidang lega pesan atinne nepukin I Macan suba mati,0,-4.0,1,0
22,Tokoh-1,"['I Kedis Puuh', 'I Puuh']",Protagonist,30, Nyen nawang saget jeg mulih ia I Kedis Puuh mai buin ditu idewek lakar ngamah ia,0,0.0,1,0
73,Tokoh-2,"['I Sigara', 'I Segara', 'Sigara']",Protagonist,29, Sapasira Jerone Dados wenten driki ring sisin tukade Samaliha wantah ngaraga pamargine nenten wenten sane ngiringang Masaur anake lingsir Nah Cening Cening ane madan I Sigara Mara keto baose buin ia makesiab I Sigara sawireh ia tawanga madan I Sigara,0,-1.0,1,1
104,Tokoh-18,['pramisuarin Ida Sang Prabhu'],Protagonist,27, Kacerita uling manike ento kone metu tirta suci tur katunas antuk pramisuarin Ida Sang Prabhu,0,0.0,1,0
89,Tokoh-1,['Men Sugih'],Antagonist,6, Ditu Men Sugih ngomong Ih cai Tiwas alihin ja icang kutu yen suba telah kutun icange nyanan upahina baas,0,0.0,1,0
89,Tokoh-2,"['Men Tiwas', 'Tiwas']",Protagonist,29, Men Tiwas jani sugih nadak pianakne makejang nganggo bungah lantas ia pesu mablanja,0,-1.0,1,1
96,Tokoh-7,['I Tampul'],Protagonist,41, I Tampul,0,0.0,1,0
100,Tokoh-2,['Men Tuung Kuning'],Antagonist,1,Ada tuturan satua Pan Tuung Kuning teken Men Tuung Kuning,0,0.0,1,0
55,Tokoh-2,"['I Macang Poleng', 'I Macan']",Antagonist,79, Cendek satua I Macan anyud tur mati dadi pekelem di tukade,0,-4.0,1,0
24,Tokoh-4,"['I Temisi', 'Temisi']",Antagonist,30, Tan kacaritanan di jalan suba enggal ia neked di purian laut nangkil ring Ida Sang Prabu asapuniki aturne Inggih Ratu Sang Prabu punapi awinan palungguh Cokor I Dewa nembe pisan nauhin parekane sakadi titiang Ngandika Ida Sang Prabu Cai Temisi awinan nira nauhin cai ne ada panguning I Blatuk tekening nira sajake cai indeng-indeng ngaba umah Inggih wiakti pisan sakadi pangandikan palungguh Cokor I Dewa,0,4.0,1,0
98,Tokoh-2,"['Men Jempenit', 'Men jempenit']",Antagonist,54, Kacarita dening makelo Pan Jempenit tusing teka uli malali jemaka lantas teken Men Jempenit bungkunge tur bungkunganga nebuk,0,0.0,1,1
80,Tokoh-1,"['I Singa', 'prabu Singa', 'I singane', 'I Sing', 'Singa']",Antagonist,39, I Singa pedih pesan laut ngengsebang nguber,0,-5.0,1,1
27,Tokoh-2,"['memene', 'Me', 'meme', 'Meme', 'i meme', 'memenne', 'memene I Belog']",Protagonist,69, sing kodag-kodag baan demen keneh memene ngelah mantu ane cager bakal nulungin magarapan,0,3.0,1,0
118,Tokoh-5,"['Ida Anake Agung', 'anake agung']",Antagonist,48, Duaning anake agung kaliwat momo murka dadi arsaang Ida kurenan I Agete,0,0.0,1,0
105,Tokoh-2,"['Ida Raden Galuh Daha', 'I Nanak Galuh', 'Raden Galuh', 'Ida Raden Galuh', 'Raden Galuhe', 'Raden Galuh', 'Galuh Daha', 'raden galuh', 'I Raden Galuhe', 'I Radem Galuh', 'i raden galuh', 'ratu Raden Galuh', 'galuh Daha', 'I Galuh Daha']",Protagonist,218, Ne jwangin I Raden Galuh kaki,0,0.0,1,1
109,Tokoh-10,"['I Detyabaka', 'I Detya Baka']",Protagonist,8, Banggiang titiang manten serahang ring I Detyabaka mangda titiang molihang kedarman titiang misadia ngawe karahajengan rabi,0,0.0,1,0
92,Tokoh-4,"['anake jada punika', 'anake jada']",Antagonist,75, Sane mangkin ri tatkala wengi sesampun mararean yudane kacritanan ri sedek Ida Sang Prabhu merem ring pasraman dereng majanten ida makolem saget malih rauh anake jada sane dumun saha baos Ih cai Anak Agung loba buat pinunas caine mantuk ring Ida Sang Hyang Widi liunan suba kalinggihan,0,-2.0,1,0
23,Tokoh-1,"['I Balu Kawanan', 'Beli Kawanan']",Protagonist,31, Bin maninne teka buin I Balu Kawanan kema,0,0.0,1,0
30,Tokoh-1,['Pan Meri'],Protagonist,62, Keto yening dadi jadma maparisolah utawi malaksana patut tusing loba cara Pan Meri sinah kapaica wara nugrah sane nekaang bagia,0,5.0,1,0
85,Tokoh-1,"['I Lutung', 'Lutung', 'Tung']",Antagonist,6, Sedek seleg I Kancil ngamah nengok I Lutung ngelanting di punyan kayune,0,0.0,1,1
106,Tokoh-1,"['Ingtai Nyonyah', 'Nyonyah Ingtai', 'Nyonyah Ingati', 'Ni Ingtai', 'I Nyonyah Ingtai', 'Ni Nyonyah', 'Ni Nyonyah Ingtai']",Antagonist,22, Mresidayang raris Ni Nyonyah munahang kasungkawan I Babah Sampik,0,0.0,1,0
27,Tokoh-1,"['I Belog', 'Belog']",Antagonist,64, Buin maninne I Belog paek teken memene kabenengan ngentut,0,-5.0,1,1
87,Tokoh-3,"['Sang Kul Putih', 'Sang Kul Putihe']",Protagonist,8, Disubane makelo unduke buka keto ada kone sang maragu pawiku ane mapesengan Sang Kul Putih makelingin apanga para panjake makejang mawali ka jati angga eling ring kawitan subakti ring Ida Sang Hyang Widhi,0,5.0,1,0
73,Tokoh-1,['I Wingsata'],Antagonist,16, Disubane neked jumah jeg sahasa kone nyagjag I Wingsata tur mamunyi kene Ih Cai Sigara cen pipis pamelin ben ane maan di peken busan Mai aba ne suba tengai Icang tonden nginem tuak,0,0.0,1,0
18,Tokoh-7,"['brahmana sakti', 'sang brahmana sakti', 'Sang Brahmana', 'Sang Brahma']",Protagonist,9, Manggihin Dewi Kunti bakti pisan ngturang ayah drika raris Sang Brahmana mapaica mantra sakti sane prasida nuur betara sane kapuja miwah ngwehin panugrahan utama,0,6.0,1,0
105,Tokoh-2,"['Ida Raden Galuh Daha', 'I Nanak Galuh', 'Raden Galuh', 'Ida Raden Galuh', 'Raden Galuhe', 'Raden Galuh', 'Galuh Daha', 'raden galuh', 'I Raden Galuhe', 'I Radem Galuh', 'i raden galuh', 'ratu Raden Galuh', 'galuh Daha', 'I Galuh Daha']",Protagonist,216, Dong mai ajak Raden Galuh suba kematyang sembene,0,0.0,1,1
92,Tokoh-4,"['anake jada punika', 'anake jada']",Antagonist,78, Taler sausan mabebaosan sada bangras kadi punika kocap malih anake jada punika ical tan pawekas,0,-2.0,1,1
27,Tokoh-3,"['kurenane', 'Kurenanne', 'knurenane', 'Kurenan I Beloge']",Protagonist,83, Kurenanne jemet ngabaang ia nasi,0,6.0,1,0
44,Tokoh-7,"['Embok Angsa', 'Embok']",Protagonist,41, Buin acepok icang ngingetang apang eda pesan Beli Embok ngengsapin petinget icange i busan,0,0.0,1,0
48,Tokoh-6,"['I naga Taksaka', 'I Naga taksaka', 'I Naga Taksaka', 'Naga']",Antagonist,31, Nepukin unduke buka keto ditu lantas I Paksi Gagak dahat sebet sawireh I Kasiape Kepuh tusing satya semaya tur masawitra ngajak anak drowaka cara I naga Taksaka sane kaliwat degag tur bonggan sing ja buungan ia lakar nepukin pakeweh tur mati ulian laksanane ane ten satya,0,-12.0,1,1
105,Tokoh-2,"['Ida Raden Galuh Daha', 'I Nanak Galuh', 'Raden Galuh', 'Ida Raden Galuh', 'Raden Galuhe', 'Raden Galuh', 'Galuh Daha', 'raden galuh', 'I Raden Galuhe', 'I Radem Galuh', 'i raden galuh', 'ratu Raden Galuh', 'galuh Daha', 'I Galuh Daha']",Protagonist,34, Kenak pesan Ida Raden Galuh sing ja Ida uning teken raga bakal katadah,0,0.0,1,1
73,Tokoh-2,"['I Sigara', 'I Segara', 'Sigara']",Protagonist,40, Kacerita ne jani sasubane I Sigara munut pusakane ento marasa ia sayan tenang suud makaengan sakewala tusing pesan ia nawang kawigunan pusakane ento,0,0.0,1,1
46,Tokoh-1,"['I Wayan Tigaron', 'I Tigaron']",Antagonist,13, Dugas enu pada cerik ia demen malali-lali ajaka I Wayan Tigaron ngulungang sentul sambilanga madedemenan magelanan,0,3.0,1,0
17,Tokoh-1,"['Ni Jepun', 'Dadong Jepun', 'Dadong', 'Dong']",Protagonist,28, Disirepne ento Dadong Jepun mangipi makeber ngindang di langite,0,0.0,1,1
72,Tokoh-2,"['pekakne', 'Pekakne', 'pekak']",Protagonist,7, Wireh sai maan udang sayan demen ia nutug pekakne,0,6.0,1,1
39,Tokoh-3,"['Manusa', 'i manusa']",Antagonist,26, Apa makrana Sawireh ia i manusa sing ja nawang welas asih,0,0.0,1,1
31,Tokoh-1,"['I Belog', 'belog']",Antagonist,9, Lantas dagang bebeke ngemaang I Belog susuk buin duang tali,0,-5.0,1,1
92,Tokoh-9,"['anake agung', 'Agung', 'Ida Anake Agung', 'Anak Agung']",Antagonist,77, Asapunika kocap panguman saha pamatbat anake jada punika ring Ida Anake Agung,0,0.0,1,1
74,Tokoh-5,['I Saunggaling'],Antagonist,47, Selanturnyane I Jayaprana mapinunas ring I Saunggaling mangda digelis mancut keris marep ring I Jayaprana,0,0.0,1,0
14,Tokoh-1,['Pan Badung'],Antagonist,25, Indike punika sane mawinan sayangsayang ngon Pan Badung ngantenang indike sane wenten ring arep ipun,0,0.0,1,0
77,Tokoh-3,"['I Macan', 'macan']",Antagonist,32, Munyin i Bojoge lantas guguna teken I Macan,0,0.0,1,1
1,Tokoh-2,"['pianakne muani', 'Pianakne', 'pianakne']",Antagonist,17, Lantas ia ngomong teken pianakne,0,1.0,1,1
99,Tokoh-1,"['Pan Poleng', 'pan Poleng', 'Pan Polenge totonan']",Protagonist,1,Ada tuturan satua madan Pan Poleng,0,0.0,1,1
71,Tokoh-7,"['meme', 'Meme', 'memene', 'memen anake cerik ento', 'memen anake cerik']",Protagonist,20, Makelo kone baana bengong lantas tumbuh dayane memen anake cerik,0,0.0,1,0
61,Tokoh-3,"['katak', 'katake', 'I Katak']",Protagonist,26, Ditu icang kena pastu pang sing buin mani puan ngamah katak,0,0.0,1,0
80,Tokoh-7,"['I Beduda', 'beduda']",Antagonist,21, Ai beduda corah dadi iba ngawag-ngawag ngai bangbang dijalane laksana ibane ngaenag gumi biut,0,0.0,1,0
30,Tokoh-2,"['merine ento', 'Merine bengil ento', 'merine', 'ri', 'merin titiange', 'merin icange', 'meri', 'merine Pan Meri', 'meri icange', 'Meri icange', 'merine bengil ento', 'meri Pan Meri']",Protagonist,45, Sakewala Pan Meri setata ngorahang tidong kerana mula saja merine makejang ento tidong merine Pan Meri,0,0.0,1,1
11,Tokoh-1,"['Bhagawan Domia', 'Ratu Bhagawan', 'Ida Bhagawan Domia', 'Ida Hyang Bhagawan', 'Ida Bhagawan']",Protagonist,44, Unduke ento patuh masi kaiwangang olih Ida Bhagawan Domia duanuing ngrebutin godel mapuara godele berag,0,1.0,1,1
99,Tokoh-16,"['gadagan sarapa', 'I gadagan', 'gadagane', 'gadaganne']",Antagonist,79, Gelisin satua bakatange bungkunge ento tekening gadaganne bange lantas meyonge,0,0.0,1,0
6,Tokoh-2,"['I Blenjo', 'Blenjo', 'Njo']",Antagonist,56, I Blenjo laut ngadukang nasinne buin orahanga bes anyutan,0,0.0,1,1
12,Tokoh-21,"['pianakne', 'pianak Meme', 'pianak tiange', 'panakne', 'pianakne muani', 'pianak Men Bekung']",Protagonist,102, Masaut panakne nuturang tingkah pajalane luas,0,0.0,1,0
108,Tokoh-10,"['Dewata Nawa Cengkar', 'Dewata Cengkar', 'Dewata cengkar', 'Dewate Cengkar']",Protagonist,30, Mewali Dewata Cengkar alumbang udeng cai nunas tanah anggon apa Sapalan nunas aektar apang ada anggon mertiwi lamun keto lautang kelesang udenge turmaning sikut tanahe kola suba enggalan Makita nadah sapunika baos Dewata Cengkar,0,0.0,1,1
105,Tokoh-2,"['Ida Raden Galuh Daha', 'I Nanak Galuh', 'Raden Galuh', 'Ida Raden Galuh', 'Raden Galuhe', 'Raden Galuh', 'Galuh Daha', 'raden galuh', 'I Raden Galuhe', 'I Radem Galuh', 'i raden galuh', 'ratu Raden Galuh', 'galuh Daha', 'I Galuh Daha']",Protagonist,18, Ratu Dewa Agung punapi okan Cokor I Dewa Ida Raden Galuh Ida palaibang papeteng ring taman,0,0.0,1,1
101,Tokoh-1,['Pan Mangut'],Protagonist,40, Kanti godele ento suba dadi gede Pan Mangut enu ngidaang negen,0,2.0,1,0
28,Tokoh-4,"['Bapa', 'bapa', 'bapanne', 'bapane', 'Bapa Pan Sari']",Antagonist,31, Nah lautang Bapa menek disubane ada eduk ulung icang ja nuduk tur munduhang,0,0.0,1,1
26,Tokoh-3,['Pan Sari'],Protagonist,24, Buin mani semengne mara bangun Pan Sari suba ngojog ka sanggah,0,0.0,1,0
20,Tokoh-1,"['sang Prabu Beksa', 'sang prabu', 'Sang prabu']",Antagonist,1,Di panegara madang Kemulan ada sang Prabu Beksa madue putra papitu makasami istri-istri,0,0.0,1,1
14,Tokoh-2,['Ni Badung'],Protagonist,12, Gelisang satua sakadi sane sampun-sampun Ni Badung ngelaksanayang geginannyane rahina semeng malelebengan ngelantur reris ipun luas ketengahing bet,0,0.0,1,0
19,Tokoh-1,"['sang Ekalawya', 'Sang Ekalawya', 'Ekalawya', 'sang ekalawya']",Protagonist,11, Ekalawya Mangda Idewa uning titiang niki mawasta Sang Ekalawya titiang sampun sane manah asu Idewane ngantos padem asu Idewane,0,0.0,1,1
64,Tokoh-2,"['I Kekua', 'Kekua']",Protagonist,40, Kacerita I Kekua suba ada di tengah semere,0,0.0,1,1
12,Tokoh-19,"['kurenanne', 'kurenane']",Antagonist,2, Sedek dina anu lantas luas Men Bekung ajaka kurenane ka alase ngalih saang,0,0.0,1,0
64,Tokoh-1,"['I Lutung', 'Lutung', 'Tung', 'I utung']",Antagonist,76, Demen cai malalianang api sinah cai lakar puun I Kekua lantas ngandong I Lutung nuju umahne,0,-2.0,1,1
70,Tokoh-2,"['ida anake agung', 'Ida anake agung']",Protagonist,25, Ida anake agung tengkejut lantas matangi,0,0.0,1,1
10,Tokoh-3,"['Ida Sang Prabu', 'Ida Sang prabu', 'sang prabu', 'ida sang prabu', 'Ratu sang prabu', 'Ratu Sang Prabu']",Protagonist,83, Ratu Sang Prabu titiang nunas ampura,0,0.0,1,1
19,Tokoh-3,"['Sang Arjuna', 'Arjuna', 'sang arjuna', 'sag Arjuna', 'cening Sang Arjuna']",Protagonist,23, Ngawit punika Sang Arjuna mapuspata sidimpil,0,0.0,1,1
12,Tokoh-16,"['I Gagak Petak', 'Gagak Petak', 'I Gagak Petake', 'Gagak Petake', 'gagak petak', 'gagak petake']",Protagonist,109, Disubane Ida Anake Agung polih Gagak Petak jeg prajani kenak rabinidane tur I Gagak Petak tan ja kanggen napi-napi sakewanten ubuhin Ida tur linggih-linggihin Ida,0,0.0,1,1
60,Tokoh-8,"['I Sampi', 'Sampi']",Protagonist,29, Kacerita I Sampi tusing ngelah pasaut,0,0.0,1,1
105,Tokoh-16,"['I Rangsasam I rangsasa', 'I Rangsasane']",Antagonist,208, kacerita nyanan petengne kema lantas I Lutung kumah I Rangsasane ngaba jaja jalema-jalemaan,0,0.0,1,0
64,Tokoh-1,"['I Lutung', 'Lutung', 'Tung', 'I utung']",Antagonist,37, enggalin suba cai tuun I Lutung kendel pisan atine ningalin I Kekua matunjel,0,0.0,1,1
12,Tokoh-7,"['memene', 'Meme', 'meme', 'me']",Antagonist,95, Masaut memene Anak pianak tiange suba mati,0,-4.0,1,0
112,Tokoh-5,['I Tatit'],Antagonist,10, I Tatit ngraos teken I Patih Sambada nerangang panjake pada kasengsaran berag aking,0,1.0,1,0
91,Tokoh-1,['Ni Bawang'],Protagonist,8, Ni Bawang anak jemet duweg megae nulungin reramane,0,4.0,1,0
34,Tokoh-2,"['samong', 'Sang Samong', 'Samong', 'I Samong']",Antagonist,49, Masaut I Kancil Nah lamun keto paling melaha iba Samong macelep malu iba mulihan apang kai nawang tongos ibane jumahan kenken abet ibane ditu Muah dija iba nongos apang mangdene beneh baan icang mragatang prakaran ibane arepa teken ia I manusa,0,1.0,1,1
73,Tokoh-1,['I Wingsata'],Antagonist,60, Gegesonan kone I Wingsata malaib mulih tur mapi-mapi mesare di Bale daja,0,0.0,1,0
13,Tokoh-6,['anak jegeg listuayu ento'],Antagonist,72, Tan paragu anak jegeg listuayu ento nyemplungang awakne buin acepok ke danune,0,2.0,1,0
6,Tokoh-2,"['I Blenjo', 'Blenjo', 'Njo']",Antagonist,3, Kaceritayang I Blenjo ento anak bocok maimbuh belog sakewala tusing pesan ia taen nyak ngakuin dewekne belog,0,-10.0,1,1
105,Tokoh-2,"['Ida Raden Galuh Daha', 'I Nanak Galuh', 'Raden Galuh', 'Ida Raden Galuh', 'Raden Galuhe', 'Raden Galuh', 'Galuh Daha', 'raden galuh', 'I Raden Galuhe', 'I Radem Galuh', 'i raden galuh', 'ratu Raden Galuh', 'galuh Daha', 'I Galuh Daha']",Protagonist,47, Ditu di gook kayune beduur engkebanga Raden Galuh teken Me Lutung,0,0.0,1,1
46,Tokoh-10,"['I Wayan Tirta', 'I Tirta', 'Wayan Tirta', 'beli Wayan Tirta']",Antagonist,31, Lantas mapamit I Made Tanu tekemng I Nyoman Karang nglaut nyrutcut pejalane ngamulihang sawireh suba pasti ane nyakina teken Ni Sukasti tuah pianakne I Wayan Tirta,0,5.0,1,1
32,Tokoh-1,"['I Bikul', 'Bikul', 'I bikul', 'bikul cenik']",Protagonist,2, Di sisi kenawan jedinge ane gede ada bikul cenik ngoyong ditu,0,3.0,1,1
69,Tokoh-1,"['I Kancil', 'Kancil']",Antagonist,9, Ditlagane ento masi ada I Kancil sedeng minum yeh tlagane,0,0.0,1,1
98,Tokoh-7,"['lelipine', 'lelipi']",Protagonist,20, Mara keto embusina lantas lelipine,0,0.0,1,0
105,Tokoh-8,"['I Sampi Wadak', 'I Sampi', 'Jro Sampi', 'I Sampine', 'Sang Sampi', 'Sampi', 'I sampi', 'I sampi wadak', 'sampi wadak', 'I Sampi Wadake']",Protagonist,89, Pah I sampi dadi ngawag-ngawag gati I sampi ngomong,0,1.0,1,1
36,Tokoh-1,"['I Celempung', 'Celempung']",Antagonist,25, Makejang anake ngerimik To ngudiang I Celempung sangkep nyangkol kuluk jeg soleh gen tingkahne mabet paling saying tekening buron gen agemne,0,0.0,1,1
98,Tokoh-1,"['Pan Jempenit', 'pan jempenit', 'Pan jempenit']",Protagonist,15, Pan Jempenit dadi talinin cucun kaine Matur Pan Jempenit Inggih dewa ratu ten titiang nika nalinin nika tuni titiang ka pasisi raris panggihin titiang anak makta lelipi matali raris idih titiang,0,4.0,1,1
98,Tokoh-18,"['i dadeleg', 'i deleg', 'deleg']",Antagonist,108, Sasubane neked di teben tepukin lantas i dadeleg laut cotota ban i kedis muwun,0,0.0,1,0
69,Tokoh-2,"['I Siput', 'I Siputane', 'Siput']",Protagonist,31, Makejang burone masuryak satekedne I Siput,0,0.0,1,1
56,Tokoh-4,"['Ki Dukuh Sakti', 'I Kaki Dukuh', 'Ki Dukuh', 'Jero Dukuh']",Protagonist,26, Ia enggal nerima pelajahan ane kaajahin olih Ki Dukuh,0,0.0,1,0
20,Tokoh-14,"['raksasa', 'I Raksasa']",Antagonist,75, Ditu lantas I Raksasa pedih tekening jitne ane suba ngamah sakayane makejang,0,-5.0,1,1
54,Tokoh-1,['I Kerug'],Antagonist,62, I Kerug lantas baanga tempo abulan yening tusing ngidaang mayah umahne lakar juanga,0,1.0,1,0
42,Tokoh-1,"['Ni Luh Arum', 'Ni Luh Arume', 'Luh Arume', 'Luh Arum', 'Luh', 'Luh arum']",Antagonist,80, Ni Luh Arum kapiagen kenehne mara I Donglen ngorahang awakne sakit incuh ngulig boreh tagih borehina I Donglen sing nyak mangorahang dingin,0,0.0,1,1
100,Tokoh-5,"['Raden Galuh', 'Cening Galuh', 'cening']",Protagonist,20, Mara keto pangandikan ajine lunga lantas Raden Galuh ngrereh biange,0,0.0,1,0
88,Tokoh-3,"['Pangerain Jempong', 'Pangeran Jembong']",Protagonist,39, Gelisin satua suba suud nyraya petengne ngojog ia kema sig jeroan dane Pangeran Jembong tur kaongken pianak teken Pangeran Jembong,0,0.0,1,0
31,Tokoh-2,"['memene', 'Memene']",Protagonist,5, Lantas memene buin ngomong kema jani cai engal-enggal ka peken terus meli be dadua di tongos dagang bebeke,0,1.0,1,1
92,Tokoh-12,['Ida Sang Prabhu'],Protagonist,74, Yadiastun sampun labda karya pamargan ida magegebug sakewanten kari wenten asiki Ida Sang Prabhu sane nenten prasida antuk ida ngaonang,0,0.0,1,0
11,Tokoh-2,"['Sang Utamaniu', 'Sang Utamaniune', 'Ida Sang Utamaniu']",Antagonist,28, Masaur Sang Utamaniu Inggih Dang Guru titiang sairinga ring sapituduh Dang Guru,0,0.0,1,0
57,Tokoh-2,['Pan Cening'],Protagonist,27, Kacerita jani nuju Pan Cening kema ke teban I langganane jeg makesiab kone Pan Cening nepukin unduke ento lantas ia matakon kene,0,0.0,1,0
12,Tokoh-12,"['Ni Cili', 'Cili']",Antagonist,89, Di subane tegeh makeber lantas bangun I Raksasa saget nota lawatne Ni Cili negakin Gagak Petak ajaka tetelu,0,1.0,1,1
8,Tokoh-2,"['belibis putih', 'kedise', 'kedis Belibis Putih', 'Belibise', 'belibise', 'I Belibis Putih']",Protagonist,43, Ditu I Belibis Putih ngorahin Narajana apang ngalih emas-emasan ento,0,0.0,1,1
105,Tokoh-2,"['Ida Raden Galuh Daha', 'I Nanak Galuh', 'Raden Galuh', 'Ida Raden Galuh', 'Raden Galuhe', 'Raden Galuh', 'Galuh Daha', 'raden galuh', 'I Raden Galuhe', 'I Radem Galuh', 'i raden galuh', 'ratu Raden Galuh', 'galuh Daha', 'I Galuh Daha']",Protagonist,199, Suba neked jumahne ngandika lantas Raden Galuh,0,4.0,1,1
41,Tokoh-1,"['I Congeh', 'Congeh']",Protagonist,28, Ih cai Congeh dibi sanja amonto gelah suba maang cai piteket nanging cai tusing masih ngerti apa isin pitekete totonang,0,0.0,1,0
71,Tokoh-7,"['meme', 'Meme', 'memene', 'memen anake cerik ento', 'memen anake cerik']",Protagonist,15, keweh gati memen anake cerik ento,0,0.0,1,1
108,Tokoh-4,"['I Dora', 'Bapa Dora', 'Dora']",Protagonist,37, Sarauhe irika tan mari ngojog genah I Dora Jaga ngrauhin titah Sang Aji Saka,0,0.0,1,1
97,Tokoh-1,"['Pan Balang Tamak', 'Pan Balang Tamake']",Antagonist,52, Maninne makiken sangkep lantas Pan Balang Tamak ngaba jaja uli injin mapulung-pulung amun tain cicinge teken yeh laut pejang-pejangina sig sendin bale banjare muah kecirina teken yeh,0,0.0,1,0
62,Tokoh-7,"['meme', 'Meme', 'memene', 'memenne', 'memen Caine', 'memen tiange']",Protagonist,22, Yen jakti tiang kapica amerta ane bakal anggon tiang nebus memen tiange janten tiang misadia jagi ngiring kayun Batara,0,0.0,1,0
96,Tokoh-1,"['Pan Angklung Gadang', 'Bapa Angklung Gadang', 'Pan Angklung Gadange', 'Angklung Gadang', 'I Angklung Gadang']",Antagonist,100, Nah suba kone tengai kacerita suba kone suud mlebengan tur pragat ngadonang lawar jejeruk gegecok jukut makejang suba pada pragat lantas Pan Angklung Gadang ngomong teken kurenanne Memenne ne laware wadahin cubek kema pejang di langgatan paone Ne nasine telung sok kema pejang di langgatan mambenge Ne jukute pejang di tengah glebege Ne jani critayang anake masangkepan di bale banjare suba uling i tuni nuduk putra dedandan ento suba pragat makejang,0,3.0,1,1
43,Tokoh-3,"['I Durma', 'I durma', 'Cening Durma', 'cening Durma', 'cening']",Protagonist,25, Kacarita jani I Durma suba ngayah malajah di pesraman Jero Dukuhe,0,0.0,1,1
63,Tokoh-1,"['I Lengar', 'Lengar', 'I Lengar paing keliha', 'I Lengar paling keliha', 'Ane paling keliha']",Protagonist,4, Ane paling keliha makeneh ngalih anak luh lakar anggona kurenan,0,0.0,1,0
48,Tokoh-6,"['I naga Taksaka', 'I Naga taksaka', 'I Naga Taksaka', 'Naga']",Antagonist,44, Pemuputnyane I Naga Taksaka mati baan nandang sakitne,0,-4.0,1,1
63,Tokoh-1,"['I Lengar', 'Lengar', 'I Lengar paing keliha', 'I Lengar paling keliha', 'Ane paling keliha']",Protagonist,13, Ningeh munyin I Lengar paling keliha lantas ia masaut Ih cai Lengar yen saja cai dot teken pianak icange jani ada pangidihan icange teken cai,0,0.0,1,1
61,Tokoh-3,"['katak', 'katake', 'I Katak']",Protagonist,41, Icang kapituduh ngaba soroh katake kemu,0,0.0,1,0
55,Tokoh-5,"['I Kidang', 'Kidang']",Protagonist,60, Makecos I Kidang ngalih tongos I Macanne medem,0,0.0,1,1
12,Tokoh-7,"['memene', 'Meme', 'meme', 'me']",Antagonist,93, Kauk-kauk kone I Bintang Lara Meme Meme,0,0.0,1,1
64,Tokoh-2,"['I Kekua', 'Kekua']",Protagonist,47, Ngantos mati apine mara I Kekua bani pesu,0,-2.0,1,1
112,Tokoh-2,"['Sang Prabu Singa', 'prabu Singa', 'Prabu Singa', 'Sang Singa']",Protagonist,18, Sakewenten ampurayang pisan sane mangking Sang Prabu Singa nyesel raga antuk kadropon makanti ring I ratu,0,0.0,1,1
30,Tokoh-2,"['merine ento', 'Merine bengil ento', 'merine', 'ri', 'merin titiange', 'merin icange', 'meri', 'merine Pan Meri', 'meri icange', 'Meri icange', 'merine bengil ento', 'meri Pan Meri']",Protagonist,22, Dija ya merin titiange,0,0.0,1,0
54,Tokoh-1,['I Kerug'],Antagonist,32, Dewa ratu I Kerug tusing inget mulih,0,0.0,1,0
49,Tokoh-2,"['Dadong Getget', 'dadong', 'Dadong', 'I Dadong', 'I Dadong Getget']",Protagonist,62, Turmaning jegeg sekadi-kadi I Dadong Getget ento jege prajani,0,2.0,1,1
119,Tokoh-1,"['pedando', 'Ida Pedanda']",Protagonist,1,kacerita wenten pedando mamagi nglintangin tukad nyat,0,-5.0,1,0
71,Tokoh-1,['I Pudak'],Antagonist,53, Reramane pada sebet ningehang I Pudak nektek pianakne anggona amah-amahan siap nanging I Pudak tusing pisan ya ningehang tutur reramane totonan,0,-3.0,1,0
85,Tokoh-1,"['I Lutung', 'Lutung', 'Tung']",Antagonist,18, I Lutung ngenggalang makecog ke duur punyan nyambune,0,0.0,1,1
105,Tokoh-2,"['Ida Raden Galuh Daha', 'I Nanak Galuh', 'Raden Galuh', 'Ida Raden Galuh', 'Raden Galuhe', 'Raden Galuh', 'Galuh Daha', 'raden galuh', 'I Raden Galuhe', 'I Radem Galuh', 'i raden galuh', 'ratu Raden Galuh', 'galuh Daha', 'I Galuh Daha']",Protagonist,163, Be magrehgohan kone I Lutung nyuun payuk misi baas kacerita suba Neked jumahne mataken kone Raden Galuh,0,0.0,1,1
50,Tokoh-5,"['i singa', 'I singa', 'singa']",Antagonist,10, Anak ngujang cai mare teka ke sebun cange petakon i Bapa Gelatik Ngujan cai ngaru ngaruin panak-panak cange I singa sing ngerunguang lantas buin majalan,0,0.0,1,1
27,Tokoh-2,"['memene', 'Me', 'meme', 'Meme', 'i meme', 'memenne', 'memene I Belog']",Protagonist,61, Aduh Tusing kodag ban meme nyakapin Cai ngajak bangke,0,0.0,1,1
39,Tokoh-2,"['I Macan', 'Macan']",Antagonist,19, Tuah Cai I Macan ane beneh,0,1.0,1,1
86,Tokoh-3,"['belie', 'i beli', 'bli']",Antagonist,24, Kerane suba tawang cang bli mula corah,0,0.0,1,0
25,Tokoh-4,['I Mantri'],Protagonist,17, Suba I Mantri sah uli kubune ento ngeling anake cerik nagih ajengan,0,1.0,1,0
83,Tokoh-1,"['I Lutung', 'Sang Lutung']",Antagonist,11, Demen kenehne lakar ngamah biu nasak laut ia masaut enggal Aduh Sang Lutung yen keto apa kaden melahne nanging kenken kema sawireh pondoke ento joh tukad cengcenge linggah buina keweh pesan ngliwat,0,6.0,1,0
105,Tokoh-11,"['Me Lutung', 'I Lutung', 'Lutung', 'Men Lutunge', 'I Lutunge', 'meme Lutung', 'me Lutung']",Protagonist,262, Sedeng gatina I Lutung mamanting lantas trojoga teken cicinge tur kepet-kepetanga,0,0.0,1,1
53,Tokoh-3,"['i pangangon', 'I pangangon', 'pangangon']",Antagonist,12, Sabilang tengai i pangangon teka mai sambilanga masayuban laut ngleslesin kulit icange,0,0.0,1,1
53,Tokoh-1,"['punyan kepuh gede tur tegeh', 'I Kepuh', 'Kepuh']",Antagonist,75, Apine sayan ngedenang kanti I Kepuh puun sengeh,0,-5.0,1,1
27,Tokoh-1,"['I Belog', 'Belog']",Antagonist,45, Nang tolih jeneng Ibane nyak masaih ajak tlapakan batis Icange Terus I Belog majalan sabatek anak luh tepukina lemesanga ajakina nganten,0,-5.0,1,1
24,Tokoh-4,"['I Temisi', 'Temisi']",Antagonist,20, Awinan titiang purun ngedig kulkul salemah-lemah wireh I Temisi setata ipun ileh-ileh ngaba umah,0,3.0,1,1
40,Tokoh-12,['I Matul'],Protagonist,20, Keto mase I Semut ulung dugas I Matul ngeteban batis,0,0.0,1,0
66,Tokoh-1,['I Menceng'],Antagonist,13, Jemakangan nasi baanga I Menceng,0,0.0,1,0
120,Tokoh-3,"['I Pekak Dukuh', 'I Pekak', 'I Pekak dukuh', 'I pekak dukuh', 'dukuh']",Protagonist,45, sing not cai I Pekak dukuh ngae basa nak bakal anggona ngae upakara banten pesakapan kaine,0,0.0,1,1
67,Tokoh-1,"['sampi', 'i sampi', 'I Sampi']",Antagonist,9, I Kambing ane demen masesimbing paling demen ngorta ajak I Sampi ane baud,0,6.0,1,1
80,Tokoh-2,"['I lutung', 'I Lutung']",Antagonist,32, Mara keto raos I Lutung I Sing pedih makpak nagih nyarap ukudang I Lembune lantas I Singa ngalih I Lembu kasarengin teken I Lutung,0,-4.0,1,1
