story_id,person,aliases,type,sentence_id,text,is_dialogue,count_lexicon,is_subject,is_object
42,Tokoh-2,"['bapan Luh Arum', 'bapa', 'bapane', 'bapanne', 'Bapan Luh Arum', 'Bapan Luh Arume', 'pa', 'Bapa']",Antagonist,10, Sing apa keman bapa teken gede padha makejang sabatak ane teka mai nganggurin pianak bapane,0,2.0,1,1
62,Tokoh-3,"['Sang Garuda', 'Garuda', 'Dewa Sang Garuda']",Protagonist,15, Ento mawanan Sang Garuda pedih tur ngamuk nyiatin para dewatane makadi Sang Hyang Brahma muah Sang Hyang Siwa,0,-5.0,1,1
50,Tokoh-3,"['Bapa Gelatik', 'i Bapa Gelatik', 'Bapa', 'bape']",Protagonist,6, Nah antosan dini pituduh Bapa Gelatik lakar uber bape ia de getap nah cening lakar cak cak bape ye,0,0.0,1,1
60,Tokoh-8,"['I Sampi', 'Sampi']",Protagonist,49, Tur ia I Sampi luput tekening dandapati,0,0.0,1,1
82,Tokoh-2,"['I Kekua', 'Kekua']",Antagonist,2, Sedek dina anu I Lutung mamaling isen di tegal dukuh Kantrungan ngajak I Kekua,0,0.0,1,1
96,Tokoh-10,"['cicingne', 'cicing', 'Cicingne']",Antagonist,60, Suba suud naar rujak laut ngaukin cicingne Kuluk kuluk kuluk kletak kletak kletak,0,0.0,1,1
94,Tokoh-1,"['Ida Sang Prabu Daha', 'Ida Sang Prabu', 'Sang Prabu', 'Ratu Sang Prabu']",Antagonist,53, kacerita gelising satua Ida Sang Prabu Daha sareng prameswari lunga ka Koripan kairing antuk kaula katah,0,0.0,1,1
103,Tokoh-2,"['Raden Jajarpikatan', 'Ida Raden Jajarpikatan']",Antagonist,9, Sue-sue paksi punika ical tan wenten kanten Raden Jajarpikatan raris kemper tan uning ring kaler kelod makulilingan maideran saget wenten tlaga ngrawit kapanggih toyanipun ning magrinding tepinipun kajderin antuk sawarnaning wit sekar,0,-2.0,1,0
44,Tokoh-1,"['i empas luh muani', 'I Empas ajaka dadua luh muani', 'empas ajak dadua', 'I Empas ajaka dadua', 'I Empas makadadua', 'empase ajak dadua']",Antagonist,58, Pragatne I Empas ajaka dadua luh muani mati kadangal baan kuluk luh muani,0,-4.0,1,1
87,Tokoh-7,"['para panjake', 'Panjake', 'panjake', 'panjaknyane', 'para panjak suargane', 'panjak Ida Bhatara Indrane']",Protagonist,22, Ditu lantasan liu panjak Ida Bhatara Indrane sungkan tur liu ane seda,0,1.0,1,0
57,Tokoh-1,"['I Langgana', 'langgana', 'Langgana', 'I Langganane']",Protagonist,47, Saja kerepanga mulaniun tanahe ane suba linggah galgala ban I Langgana,0,0.0,1,1
100,Tokoh-9,"['okan idane', 'okane']",Protagonist,17, Disubane Ida rauh di puri mataken lantas okan idane,0,0.0,1,0
65,Tokoh-2,"['I Kakua', 'I Kakuane', 'Kakuane', 'kakuane']",Protagonist,10, Teked jumahne tekepanga kone I Kakua delod paonne,0,0.0,1,0
97,Tokoh-1,"['Pan Balang Tamak', 'Pan Balang Tamake']",Antagonist,24, Éngken awanan tiange kena danda Keto munyin Pan Balang Tamake dadi desane sing ada ngelah keneh nglawan paksanne Pan Balang Tamak,0,0.0,1,1
75,Tokoh-4,"['ni penek', 'Ni Penek', 'ni penak', 'penak']",Protagonist,23, Wireh asapunika panikan dane gurun pagep raris banggayang ipun irika sakewanten ipun Ni Penek sareng miara,0,3.0,1,1
73,Tokoh-2,"['I Sigara', 'I Segara', 'Sigara']",Protagonist,27, Tan pasangkan ada anak tua matengkuluk clapat-clapat maekin I Sigara ngaba sokasi tur matungked,0,0.0,1,1
32,Tokoh-1,"['I Bikul', 'Bikul', 'I bikul', 'bikul cenik']",Protagonist,40, Taline lebanga sinah I Bikul ulung patigrepe di jedinge ane maliah misi susu,0,0.0,1,1
105,Tokoh-2,"['Ida Raden Galuh Daha', 'I Nanak Galuh', 'Raden Galuh', 'Ida Raden Galuh', 'Raden Galuhe', 'Raden Galuh', 'Galuh Daha', 'raden galuh', 'I Raden Galuhe', 'I Radem Galuh', 'i raden galuh', 'ratu Raden Galuh', 'galuh Daha', 'I Galuh Daha']",Protagonist,229, Da nangis ratu Raden Galuh,0,0.0,1,1
42,Tokoh-1,"['Ni Luh Arum', 'Ni Luh Arume', 'Luh Arume', 'Luh Arum', 'Luh', 'Luh arum']",Antagonist,146, Ipidan nyen baang pianak bapane Luh Arum nyen ane anggon bapa mantu,0,0.0,1,1
92,Tokoh-8,['Ida Sang Maha Patih'],Protagonist,51, Kawibawan Sang Maha Patih Agung sane kairingang olih para tanda mantri ngawinang malih kosekan tangkah I Sudagar duaning wenten manah ipune mapairian ring Ida Sang Maha Patih,0,0.0,1,0
55,Tokoh-5,"['I Kidang', 'Kidang']",Protagonist,54, Masaut lantas I Kidang Ih Cai Angsa ajak dadua Cai setata nongos ditu di tukad tanggun kangine,0,0.0,1,1
60,Tokoh-8,"['I Sampi', 'Sampi']",Protagonist,50, To makrana kayang ka jani pasuitran I Sampi leket pesan ngajak I Lelasan,0,0.0,1,1
23,Tokoh-2,['I Balu Kanginan'],Antagonist,19, Lantas mulihan I Balu Kanginan nyemakang tungkedne,0,0.0,1,0
102,Tokoh-6,['bapa'],Antagonist,9, Sawireh Ida Hyang widhi sueca ngicenin kaslametan ditu bapa masemaya lakar suud mamangsa sarwa minane ane ada di tlagane,0,0.0,1,0
51,Tokoh-2,"['I Lutung', 'Lutung', 'I Liutung']",Antagonist,31, Kacerita jani I Keker sedek masiksikan Ih Iba Lutung mungpung ngoyong Iba boisa ngalihin kutun wakene Ndas wakene genit marukrukan,0,0.0,1,0
69,Tokoh-5,['Siput ane malunan'],Protagonist,20, Siput ane malunan masaut,0,0.0,1,0
98,Tokoh-7,"['lelipine', 'lelipi']",Protagonist,8, juang ja suba keto juanga lantas lelipine,0,0.0,1,0
30,Tokoh-3,"['Anake gede selem', 'I gede selem', 'I Gede selem', 'anake gede selem ento']",Protagonist,46, Suba keto I gede selem buin ngomong,0,3.0,1,1
46,Tokoh-12,"['Beli Gede', 'Beli', 'beli']",Protagonist,24, Masaut I Nyoman Karang Kene Beli yen ento ane bakal itungang Beli tiang nyerahang dogen sara ja ia cenik-cenike apa ke ada kembang kenehne soang-soang tiang nugtug dogen,0,0.0,1,1
112,Tokoh-2,"['Sang Prabu Singa', 'prabu Singa', 'Prabu Singa', 'Sang Singa']",Protagonist,17, Inggih Ratu Pranda mungguing kabecekin pasawitran I ratu ring Sang Prabu Singa nenten nyandang baosang,0,0.0,1,1
17,Tokoh-1,"['Ni Jepun', 'Dadong Jepun', 'Dadong', 'Dong']",Protagonist,61, Dadong Jepun kesiab maningalin unduk buka keto,0,0.0,1,1
94,Tokoh-2,"['Ida Raden Galuh Daha', 'Ida Raden Galuh', 'Raden Galuh', 'Ida Raden Gal uh', 'I Galuh Daha', 'Cening Nanak Galuh']",Protagonist,47, Sarauhe ditu lantas kagelut katangisin Ida Raden Galuh tur klemesin mangda kayun ugi ida mrabi ring Raden Mantri,0,0.0,1,1
42,Tokoh-2,"['bapan Luh Arum', 'bapa', 'bapane', 'bapanne', 'Bapan Luh Arum', 'Bapan Luh Arume', 'pa', 'Bapa']",Antagonist,140, Bapa Ia sing I Donglen anak agung anak kenken totonan diwang bagus pesan cang sing bani nyapatin,0,2.0,1,1
110,Tokoh-3,['Sang Lanjana'],Protagonist,36, Laut ia makaukan Sang Lanjana Sang Lanjana Uuuh keto pasautne Sang Lanjana,0,0.0,1,0
38,Tokoh-2,"['kambing', 'I Kambing', 'kambinge']",Antagonist,15, Sangkan kayang jani yen ada anak masilih-silihan tusing ngulihang kaorahang silih-silih kambing,0,0.0,1,0
97,Tokoh-1,"['Pan Balang Tamak', 'Pan Balang Tamake']",Antagonist,29, Maninne Pan Balang Tamak kaarahin maboros ka gunung,0,0.0,1,0
118,Tokoh-5,"['Ida Anake Agung', 'anake agung']",Antagonist,56, Kasuen-suen kasor Ida Anake Agung,0,0.0,1,1
20,Tokoh-2,"['Galuh Pradnyawati', 'Raden Galuh Pradnyawati']",Antagonist,55, Raden Galuh Pradnyawati mangucap Lara lara kajantaka apang ada jani pasubayan,0,0.0,1,1
51,Tokoh-2,"['I Lutung', 'Lutung', 'I Liutung']",Antagonist,28, Ngomong buin I Lutung Eda ja malu mulih Keker Kai sing lung asane dini padidian,0,1.0,1,1
26,Tokoh-3,['Pan Sari'],Protagonist,15, Teka lantas Pan Sari ngaturang rayunan di gedong sanggahne,0,0.0,1,0
94,Tokoh-2,"['Ida Raden Galuh Daha', 'Ida Raden Galuh', 'Raden Galuh', 'Ida Raden Gal uh', 'I Galuh Daha', 'Cening Nanak Galuh']",Protagonist,10, Ida Raden Mantri nyengguhang Ida Raden Galuh seda wastranidane lantas getep ida anggen ida ngrurubin lantas kalahina mantuk,0,-4.0,1,1
2,Tokoh-2,"['I Kerkuak', 'Kerkuak', 'kerkuak']",Antagonist,15, Gumine suba sanja tur ngancan wengi ditu lantas I Kerkuak ngajakin I Angsa mulih Angsa jani suba nagen peteng miwah mai mulih mani biin mai keto munyine I Kerkuak,0,0.0,1,1
65,Tokoh-4,"['Luh Kancrung', 'Luh', 'Luh Kancerung']",Antagonist,26, Kema lantas Luh Kancerung bakal nyemak I Kakua,0,0.0,1,1
12,Tokoh-3,"['I Bintang Lara', 'Bintang Lara', 'I Bintang Larane', 'adi Bintang Lara', 'adi', 'I adi', 'Adi Bintang Lara', 'Adi']",Protagonist,118, Masaut I Bintang Lara nuturang saunduk-undukne,0,0.0,1,1
32,Tokoh-3,"['meong gede tur mokoh', 'I Meong']",Antagonist,48, Payu besbesa awakne I Semal ban I Meong kanti ngemasin mati,0,-4.0,1,0
79,Tokoh-2,"['I Cekcek', 'cekcek', 'Cekcek']",Antagonist,37, Nah Cekcek mani puan kai mati dinumitis kaine buin acepok kai manadi siap biing selem miananan tur yan cai mati disubane cai numitis manadi siap buik kuning rajah kebek ditu mara patut cai ngalap dirin kaine,0,-4.0,1,1
29,Tokoh-1,"['I Belog', 'Belog']",Antagonist,14, Makelo I Belog ngantosang ditu masih anake ento tusing nyak bangun,0,-5.0,1,1
103,Tokoh-9,"['Beli', 'beli']",Antagonist,30, Asapunika karyanida sue-sue pantune telas ring glebeg kapanggih kuacanidane irika kengkebang raris kaambil tur ngandika teken rabine Beli dening beli tan tinut tekan ubayan tiange duk ring alase mangkin wantah amunikaan puput tiange marabi ring beli tiang pamit ajak okan beline mangda becik-becik Widiadari Nilotama raris makeber,0,4.0,1,1
91,Tokoh-5,['embokne'],Protagonist,24, Edot ngelahang penganggo miwah periasan ane bungah buka ane gelahang embokne,0,0.0,1,0
24,Tokoh-3,"['I Blatuk', 'Blatuk']",Antagonist,3, Ngandika Ida Sang Prabu Ih cai Baluan apa ada tunasang cai teken icang Raris matur I Baluan kene aturne Inggih ratu sang prabu tunasang titiang ring palungguh cokor I Dewa punapi ipun I Blatuk dados nyabran rahina ngebug kulkul gumanti ribut kaulan palungguh cokor I Dewa sawireh tan wenten pasal punapa-punapi,0,8.0,1,1
55,Tokoh-5,"['I Kidang', 'Kidang']",Protagonist,71, Kacerita I Macan Poleng nugtug I Kidang uli duri,0,0.0,1,1
96,Tokoh-10,"['cicingne', 'cicing', 'Cicingne']",Antagonist,85, Kanti keles baana nyanggem jit cicingne lantas telah tainne katos dadi tai missing makecret bek tangkahne muah kambenne I Wayan Sebetan maguegue kena tain cicing mising bonnyane mayuryuran ngebekin warung kanti onya rarud anake mablanja ditu kayang dagang masih uyut makwewengan tuara kodag ngadek bonne pengit marungan,0,0.0,1,1
80,Tokoh-1,"['I Singa', 'prabu Singa', 'I singane', 'I Sing', 'Singa']",Antagonist,38, I Singa ngamuk lautnyarap I Lelasan saget mekelid tendasne ngigel ikutne kutal-kutil,0,0.0,1,1
44,Tokoh-3,"['empase ane lua', 'empas lua', 'Empas Lua', 'i empas lua', 'I Empas lua', 'Luh', 'empase luh']",Protagonist,3, Apa Luh sahut empase muane,0,0.0,1,0
20,Tokoh-8,"['Biang raden galun', 'biang Raden Galuh', 'biang galuh', 'Biang Raden Galuh', 'I Biang', 'Biang']",Antagonist,17, Icen ja tiang asiki Biang atur okane,0,0.0,1,0
68,Tokoh-1,"['I Sangging Lobangkara', 'Sangging Lobangkara']",Protagonist,31, Kacarita jani Sangging Lobangkara kanti neked di suargan,0,0.0,1,0
93,Tokoh-5,['para tanda mantri'],Protagonist,7, Dane Ki Patih Bandeswarya satata ngiring angulih-ulih amerih sutreptining nagara kasarengin antuk para punggawa miwah sakatahing para tanda mantri pada widagda ngenterang jagat sidi wakya sandi ngucap reh tan mari nganutin linging aji agama Kutara Manawa kalih sastra sarodresti makawinan nenten wenten sane makewuhin,0,0.0,1,0
69,Tokoh-1,"['I Kancil', 'Kancil']",Antagonist,29, Monto dogen kesaktianne Kancil ane orahange plaibne paling becat I Kancil makasiab lantas ia mlaib kanti ulung batisne matatu kanti tusing bisamlaib,0,2.0,1,1
71,Tokoh-1,['I Pudak'],Antagonist,40, Yan kudang taun makelone I Pudak luas matajen ceritayang jani ia suba mulih pipisne telah kalah tuwing enu nang aketeng,0,0.0,1,0
71,Tokoh-3,['Ni Tuwung Kuning'],Protagonist,39, Kaceritayang jani ngancan kelih ngancan jemet Ni Tuwung Kuning magarapan,0,7.0,1,0
101,Tokoh-2,['Jro Kelihan Desa'],Protagonist,11, Kacerita jani Jro Kelihan Desa maan meli sampi akit lua kalawan muani,0,0.0,1,0
105,Tokoh-11,"['Me Lutung', 'I Lutung', 'Lutung', 'Men Lutunge', 'I Lutunge', 'meme Lutung', 'me Lutung']",Protagonist,112, Kacucung kacicang meme Lutung makejit ngincang,0,0.0,1,1
49,Tokoh-1,"['I Kecut', 'I kecut', 'Kecut']",Antagonist,46, Keto petakon I Dadong teken I Kecut,0,0.0,1,1
19,Tokoh-2,"['bhagawan Drona', 'Hyang Bhagawan', 'Sang guru Drona', 'Dang Hyang Drona', 'Sang Bhagawan', 'Guru Drona']",Antagonist,14, Sasampun kapanggih ring tengahin alase irika raris Sang Arjuna maswabhawa bendu raris mataken ring Sang Bhagawan,0,-2.0,1,0
12,Tokoh-13,"['widiadari ajaka lelima', 'dedarine buin dadua', 'dedarine dedari', 'I Dedari', 'Ni Dedari']",Antagonist,67, Lantas medal toyan susunidane tur kawadahin sibuh mas lantas kaicen I Bintang Lara sibuhe ane misi toyan susu tur klambine lantas katurang teken Ni Dedari,0,0.0,1,0
30,Tokoh-2,"['merine ento', 'Merine bengil ento', 'merine', 'ri', 'merin titiange', 'merin icange', 'meri', 'merine Pan Meri', 'meri icange', 'Meri icange', 'merine bengil ento', 'meri Pan Meri']",Protagonist,49, Meri icange tuah aukud berag tur bengil masaut Pan Meri,0,1.0,1,1
92,Tokoh-2,['Pan Bergah'],Antagonist,13, Samaliha Pan Bergah ngrahina prasida ngadol saang ka pasar,0,4.0,1,0
120,Tokoh-1,"['I Lutung', 'Lutung', 'lutung', 'I lutung']",Antagonist,27, Mara keto pariselselne I Kekua saget teka I Lutung kruet,0,0.0,1,1
115,Tokoh-5,"['I Grungsung', 'I Grungsang', 'I grungsang']",Protagonist,92, Makruyuk I Grungsang ngalad,0,0.0,1,1
49,Tokoh-2,"['Dadong Getget', 'dadong', 'Dadong', 'I Dadong', 'I Dadong Getget']",Protagonist,30, Ambul keto Dadong mati jani,0,-4.0,1,1
86,Tokoh-2,"['meng', 'I Meng', 'Meng', 'adi Meng']",Protagonist,12, I Meng suba nawang teken satekan I Macan buka keto ento awanane ia metagenan lakar malaib,0,0.0,1,1
101,Tokoh-1,['Pan Mangut'],Protagonist,10, Ento makada Jro Kelihan Desa sayang pisan teken Pan Mangut,0,5.0,1,0
99,Tokoh-15,"['timpal-timpalne', 'timpalne']",Antagonist,53, Keto pitungan cicinge ajak timpal-timpalne,0,0.0,1,1
113,Tokoh-1,"['Sang Rama', 'Ida Sang Rama', 'Dewa Sang Rama']",Protagonist,8, I raksasa nyagjang jaga nyedayang Ida Sang Rama,0,0.0,1,1
72,Tokoh-3,"['I Gede Urub', 'Gede Urub']",Antagonist,54, Kai madan I Gede Urub,0,2.0,1,1
109,Tokoh-4,"['Sang Bima', 'Cening Sang Bima', 'Ida Sang Bima']",Protagonist,40, Sang Bima nenten purun tempal ring titah ibiang,0,0.0,1,0
109,Tokoh-4,"['Sang Bima', 'Cening Sang Bima', 'Ida Sang Bima']",Protagonist,46, Tusing pesan Sang Bima madue pikayunan jejeh lakar ngarepin I Detyabaka,0,-3.0,1,0
76,Tokoh-8,"['panyatusan bikul', 'para bikule']",Protagonist,33, Tusing makelone panyatusan bikul suba teka mapunduh tur nglinderin I Geruda,0,0.0,1,0
120,Tokoh-2,"['I Kekua', 'I kekua', 'Kekua', 'kekua']",Antagonist,37,Laut I Kekua masau Ih,0,0.0,1,1
9,Tokoh-1,"['I Belog', 'Belog']",Antagonist,34, I Belog nengil dogen tusing nyak nulungm memenne,0,-5.0,1,1
24,Tokoh-1,"['I Baluan', 'Baluan']",Protagonist,1,Ada kone tuturan satua I Baluan,0,0.0,1,1
92,Tokoh-2,['Pan Bergah'],Antagonist,19, Sane dados dasar ipun iri tan lian duaning Pan Bergah prasida makehan negen saang tur ngrahina prasida ngadol saang ka pasar,0,4.0,1,0
79,Tokoh-2,"['I Cekcek', 'cekcek', 'Cekcek']",Antagonist,14, kacerita jani dening suba pada pragat pasubayanne lantas I Cekcek makeneh-keneh kene kenehne,0,0.0,1,1
77,Tokoh-2,['Ni Wingsali'],Protagonist,7, Melaib Ni Wingsali di durin memene sambilanga matakon,0,0.0,1,0
93,Tokoh-16,['Maharaja Ikswaku'],Protagonist,50, Ida Sang prabu Manu maputra asiki maparab Maharaja Ikswaku,0,0.0,1,0
34,Tokoh-6,"['Panak icange', 'panak icange']",Protagonist,36, Panak icange nu cerik-cerik juanga abana mulihne nangingke panak icange tusing pesan ada pikenohne tekening ibanne sajawining anggona plalian dogenan,0,0.0,1,1
98,Tokoh-17,"['kedis muwun', 'i kedis muwun', 'i kedis muun']",Protagonist,105, Masaut i kedis muwun Nah meong yan keto nyak kai ngalihang,0,0.0,1,1
96,Tokoh-1,"['Pan Angklung Gadang', 'Bapa Angklung Gadang', 'Pan Angklung Gadange', 'Angklung Gadang', 'I Angklung Gadang']",Antagonist,97, Suba kone keto lantas Pan Angklung Gadang nyemak blakas nektek kayu atugel kapindanang tungked mlengget tur mapontang-pontang lantas pulasa aji mangsi kapontang-pontangin ban kudrang barak muah gadang luung pesan paturutan warnanne tur tenget pagobaan tungkede ento,0,0.0,1,1
32,Tokoh-2,"['Semal', 'I Semal']",Antagonist,38, I Semal girang sajan nepukin susu a tiing buluhe liune tur ngenggalang malaib ngaba susu atiing buluh,0,0.0,1,1
6,Tokoh-2,"['I Blenjo', 'Blenjo', 'Njo']",Antagonist,20, Dadi keweh kone I Blenjo sawireh payukne tuara sedeng anggona nglablab be bano,0,0.0,1,1
75,Tokoh-1,"['gurun pagep', 'dane Gurun Pagep', 'Dane gurun pagep', 'dane gurun pagep']",Protagonist,13, Gurun Pagep tan wenten weh raris baktana budal kapondok dane,0,0.0,1,0
10,Tokoh-8,"['kedis dara', 'Kedis dara']",Protagonist,59, Kakeberang olih kedis dara,0,0.0,1,1
116,Tokoh-1,"['I Siap Selem', 'I Siap selem', 'Siap Selem']",Protagonist,11, Yen ia ujanan pepes bisa mati keto I Siap Selem maorahan teken pianak-pianakne,0,-4.0,1,1
21,Tokoh-3,"['bapane I Getap', 'bapane', 'Bapane I Getap']",Protagonist,37, Prajani repot bapane ngedetin I Getap abana ka kubune,0,-4.0,1,0
23,Tokoh-1,"['I Balu Kawanan', 'Beli Kawanan']",Protagonist,43, Buin mulih I Balu Kawanan,0,0.0,1,0
98,Tokoh-15,"['i cicing', 'cicing', 'I cicing']",Protagonist,142, Nyak lantas i cicing,0,0.0,1,1
65,Tokoh-3,"['Pekak Dukuh', 'I Pekak Dukuh', 'I Dukuh']",Antagonist,37, Lantas bor-bora eduke ento ban I Pekak Dukuh,0,0.0,1,1
27,Tokoh-1,"['I Belog', 'Belog']",Antagonist,21, Tepukina I Belog iteh ngupin-ngupinin telin bangkung keprus-keprus keto munyinne,0,-7.0,1,1
97,Tokoh-1,"['Pan Balang Tamak', 'Pan Balang Tamake']",Antagonist,75, Gelisang cerita suba Pan Balang Tamak mati ngamah cetik paican anake agung,0,-4.0,1,0
14,Tokoh-1,['Pan Badung'],Antagonist,2, Jadma pagunungane punika mawasta Pan Badung,0,0.0,1,0
29,Tokoh-1,"['I Belog', 'Belog']",Antagonist,15, I Belog lantas makeneh-keneh Eh jenenga ia lek mara tongosin melahang jani kalahin,0,-5.0,1,1
27,Tokoh-3,"['kurenane', 'Kurenanne', 'knurenane', 'Kurenan I Beloge']",Protagonist,76, Marasa kurenane keweh ngelah somah belog tusing nawang unduk makurenan,0,-5.0,1,0
89,Tokoh-2,"['Men Tiwas', 'Tiwas']",Protagonist,25, Masaut Men Tiwas Lakar anggon tiang jukut,0,-2.0,1,1
65,Tokoh-6,"['cucunne', 'cucunne Pekak Dukuh']",Antagonist,13, Teka jani cucunne ngaba basa lakar basa uli di peken,0,0.0,1,0
34,Tokoh-7,"['Sang Kancil', 'I Kancil']",Protagonist,55, I Kancil masih bareng magedi,0,0.0,1,0
23,Tokoh-1,"['I Balu Kawanan', 'Beli Kawanan']",Protagonist,2, Ento makrana ia madan I Balu Kawanan,0,0.0,1,0
61,Tokoh-7,"['retunne', 'ratunne', 'ratun katak', 'ratun katake', 'Ratun Katake', 'I Ratun Katak']",Antagonist,10, Disubane teked ditu dapetanga uli joh ada ratun katak ane kaliwat gede awakne mokoh,0,-3.0,1,0
87,Tokoh-3,"['Sang Kul Putih', 'Sang Kul Putihe']",Protagonist,13, Sawireh sujati daging pikayun Sang Kul Putihe dahat ening gumanti ayat ngawe sutreptin jagat miwah sadagingnyane antuk mikelingin para janane mawali subakti ring Ida Sang Hyang Widhi,0,5.0,1,0
71,Tokoh-8,['I cening'],Antagonist,30, Nyen lamun ia teka lakar orahang suba mati dogen I cening,0,-4.0,1,0
74,Tokoh-2,"['Ni Layonsari', 'Layonsari', 'layonsari']",Protagonist,55, Amunika daging cerita Jayaprana miwah Layonsari sane wawu prasida makurenan saking tulus asih,0,0.0,1,1
23,Tokoh-2,['I Balu Kanginan'],Antagonist,32, Kasapa ban I Balu Kanginan Ye Beli Wayan mara teka Aa Luh beli mara teka,0,0.0,1,0
11,Tokoh-2,"['Sang Utamaniu', 'Sang Utamaniune', 'Ida Sang Utamaniu']",Antagonist,32, Unduke buka keto kauningan olih Ida Hyang Bhagawan raris Ida ngandika Cening Sang Utamaniu yen Cening subakti teken guru pikolih Ceninge ngidih-idih patut aturang abedik teken dang guru,0,13.0,1,0
115,Tokoh-9,"['siapne', 'siape', 'Makejang siapne']",Protagonist,52, Makejang siapne noltol jagung,0,0.0,1,1
105,Tokoh-11,"['Me Lutung', 'I Lutung', 'Lutung', 'Men Lutunge', 'I Lutunge', 'meme Lutung', 'me Lutung']",Protagonist,143, Ne bangkaan I Lutunge ne sai-sai mamaling byun awake beneh lesag bane,0,1.0,1,0
107,Tokoh-2,"['Ida Sang Prabhu', 'sang Prabhu', 'Sang Prabhu', 'Sang Prabu', 'Ida Sang Prabu', 'Dewa Sang Prabhu', 'I Dewa']",Antagonist,34, Wih Luh Ida Sang Prabu maraga pawikan mirib sing uning katatwaning sastra,0,0.0,1,1
53,Tokoh-1,"['punyan kepuh gede tur tegeh', 'I Kepuh', 'Kepuh']",Antagonist,40, Sawireh keto munyin I Lelipi Raja lantas kapineh-pineh baan I Kepuh,0,0.0,1,1
110,Tokoh-2,['Sang Muun'],Antagonist,4, Bulunne samah kampidne lumbang matanne gede tur galak pesan madan Sang Muun,0,-3.0,1,0
99,Tokoh-2,"['Men Poleng', 'men Poleng']",Protagonist,86, Kacerita Pan Poleng tekening Men Poleng negeh- negehang kasugihane tusing kurangan mas iya,0,0.0,1,1
65,Tokoh-1,"['I Lutung', 'Lutung', 'I Lutunge']",Antagonist,1,Kacerita I Lutung ajak I Kakua mula makantenan melah pesan,0,5.0,1,1
114,Tokoh-1,"['I Semut Api', 'Semut Api']",Antagonist,53, I Semut Api nyambatang unduke uling sijumu ngawit uling saling cadeng di jalan kanti masiat,0,0.0,1,1
15,Tokoh-3,"['I raksasa', 'I Raksasa', 'Raksasane']",Protagonist,12, Ketuju I raksasa luas lantas plaibanga manike makejang teken Ni Bulan Kuning,0,0.0,1,1
20,Tokoh-14,"['raksasa', 'I Raksasa']",Antagonist,50, Lenan teken ento I Raksasa liu masih ngubuh celeng siap bebek kedis miwah ane lianan,0,1.0,1,1
52,Tokoh-4,"['I Samong', 'I Samonge']",Protagonist,12, Masaut I Samong Nah yen keto ja raos ibane Kelesih yen tuara sida baan iba kai tusing bakal ngenkenan iba,0,0.0,1,0
73,Tokoh-2,"['I Sigara', 'I Segara', 'Sigara']",Protagonist,61, Sing makelone suba teka I Sigara uli tukade ngaba udang liu,0,1.0,1,1
39,Tokoh-2,"['I Macan', 'Macan']",Antagonist,51, Tusing ngamah-ngamah tur mati makenta ia I Macan,0,-4.0,1,1
78,Tokoh-3,"['I Paksi Siung luh', 'Siunge luh', 'luhnyane']",Protagonist,14, Taler tan kidepan antuk luhnyane taler ipun kari sedih masesambat luir padulamennyane sapuniki duh cening pianak meme cai nyai pada makejang,0,-5.0,1,0
12,Tokoh-4,"['Anak Agung', 'Anake Agung', 'Ida Anake Agung', 'Ratu Anak Agung', 'Ratu Dewa Agung', 'Ratu Dewa Anak Agung', 'Anake agung', 'Ida Anak Agung', 'anake agung']",Protagonist,142, Gelisang satua jani kacerita Ida Anake Agung rauh Ida sagrehan tur uli joh suba ngamunyiang bedil uyut pesan kone munyin bedile len jaran ngrehgeh tan papegatan,0,0.0,1,1
66,Tokoh-3,"['Bli Menceng', 'bli', 'bline']",Antagonist,36, Welanga lantas I Polos kene munyine ih nyai Polos apa baang nyai awake adi ba bli minum ubade ento masih konden seger,0,0.0,1,0
115,Tokoh-6,"['I Saa-sangkur', 'Saa-sangkur', 'I Siap Saa-sangkur', 'Siap I Saa-sangkur']",Protagonist,104, I Saa-sangkur ane mataluh,0,0.0,1,1
109,Tokoh-8,['Sang Panca Padawa'],Protagonist,2, Ditu Sang Panca Padawa madunungan di Grian Ida Sang Brahmana Luih,0,0.0,1,0
78,Tokoh-8,['paksi Belatuk'],Protagonist,19, Mawastu karenga antuk sami kakampungannyane luire Belibis Buyang kalih paksi Gowak Gadagan miwah paksi Belatuk,0,0.0,1,0
34,Tokoh-8,"['manusa', 'manusane', 'I manusa']",Antagonist,34, Kenehang icang ada jenenga sesaman icange taen ngelah salah marep teken manusane nanging icang sing pesan icang ngasen taen malaksana jele tekening manusa,0,0.0,1,1
24,Tokoh-2,"['Ida Sang Prabu Singa', 'Ida Sang Prabu', 'ratu sang prabu', 'Ratu Sang Prabu', 'Ratu sang Prabu', 'Ida sang Prabu Singa']",Protagonist,39, Sasubane teked di puri enggal-enggal ia tangkil ring Ida Sang Prabu Singa nunasang unduk ibanne kadauhan,0,0.0,1,1
105,Tokoh-2,"['Ida Raden Galuh Daha', 'I Nanak Galuh', 'Raden Galuh', 'Ida Raden Galuh', 'Raden Galuhe', 'Raden Galuh', 'Galuh Daha', 'raden galuh', 'I Raden Galuhe', 'I Radem Galuh', 'i raden galuh', 'ratu Raden Galuh', 'galuh Daha', 'I Galuh Daha']",Protagonist,182, kacerita suba lebeng ngajengang lantas Raden Galuh,0,1.0,1,1
22,Tokoh-2,"['alu gede gati', 'Alune ento', 'alu', 'I Alu', 'Alu', 'alune ento']",Antagonist,13, Alune ento tuah alu pangumbaran tusing ngelah sebun ane pasti,0,0.0,1,1
12,Tokoh-13,"['widiadari ajaka lelima', 'dedarine buin dadua', 'dedarine dedari', 'I Dedari', 'Ni Dedari']",Antagonist,66, Ditu lantas Ni Dedari nrima sibuh mase muah jaum mase lantas susunidane kacokcok apang mesu toya susu,0,0.0,1,0
47,Tokoh-5,"['I Macam', 'I Macan', 'Macan']",Antagonist,6, Ditu lantas I Macan makeneh-keneh Yen ene jani bakat ejuk kayang buin mani i dewek lakar tusing kuangan amah-amahan,0,0.0,1,1
110,Tokoh-2,['Sang Muun'],Antagonist,15, Ne suba ane madan Sang Muun,0,0.0,1,0
57,Tokoh-3,"['Ida Dukuh', 'I Kaki Dukuh']",Protagonist,29, Tiang maan ngipi karauhin ban I Kaki Dukuh tur ngandikain tiang pang numbeg tanahe di teba,0,0.0,1,0
14,Tokoh-4,"['ula aya ageng pisan', 'ula aya punika', 'ula ayane punika', 'Ula ayane punika', 'ulane punika', 'ula']",Antagonist,37, Kabaos Ni Badung sampun keni guna-guna ula ayane punika,0,0.0,1,1
86,Tokoh-2,"['meng', 'I Meng', 'Meng', 'adi Meng']",Protagonist,10, Lantas ia makakeneh kene Jani melahan I Meng dogen amah kerane I dewek suba dueg tusing ada buin ane patut palajahin teken ia,0,7.0,1,1
86,Tokoh-1,"['macan', 'I Macan', 'Macan']",Antagonist,8, Sedek dina anu I Macan masusupan di tengah alase lakar ngalih tatadahan,0,0.0,1,1
2,Tokoh-2,"['I Kerkuak', 'Kerkuak', 'kerkuak']",Antagonist,38, Aine suba endag I Angsa ajak I Kerkuak lantas ngalih amah-amahan kema ka Tegalne Pan Berag,0,1.0,1,1
13,Tokoh-4,['Bhatara Wisnu'],Protagonist,23, Bhatara Wisnu mesuang soca ngendih barak makerab,0,0.0,1,0
82,Tokoh-4,"['Luh Ayu Kantrungan', 'Luh Ayu', 'Ni Ayu Kantrungan']",Antagonist,7, Teked jumah dane dukuh ngaukin pianaknyane Luh Ayu Kantrungan tur tundene ngae basa sawireh lakar nampah I Kekua anggon lawar,0,3.0,1,1
27,Tokoh-1,"['I Belog', 'Belog']",Antagonist,98, Suba kone lebeng jukutne makaukan kurenane Wih Belog dong mai madaar Ne jukute suba lebeng,0,-3.0,1,0
51,Tokoh-2,"['I Lutung', 'Lutung', 'I Liutung']",Antagonist,17, Adeng-adeng Keker aduh jejeh wake ken Iba sriat-sriut Keto I Lutung ngraos saget enggal ia neked di alas ulun danune,0,-3.0,1,1
37,Tokoh-1,"['I Cicing Gudig', 'Cicing Gudig', 'Cicing gudig']",Antagonist,25, kacerita sedek dina anu Sang Prabu lunga maboros ka alase macelig kone I Cicing Gudig ka puri,0,0.0,1,1
